Status,Brand,Title,Discounted Price,Original Price,Discount Percent,Club Price
Added to Cart | Shortlisted | Already Viewed,Pine Kids Cotton,Knit Half Sleeves T-Shirt with Text Print - Navy Blue,384.23,499,24% Off,374.25
Added to Cart | Shortlisted | Already Viewed,Pine Kids Cotton,Woven Half Sleeves Printed Shirt Style Top &...,857.22,1099,23% Off,835.24
Added to Cart | Shortlisted | Already Viewed,Pine Kids Cotton,Knit Sleeveless Tank T-Shirts with Text Print...,538.23,699,28% Off,524.25
Added to Cart | Shortlisted | Already Viewed,Pine Kids Cotton,Knit Sleeveless Tank T-Shirt with Beach Theme...,254.15,299,16% Off,248.17
Added to Cart | Shortlisted | Already Viewed,Pine Kids Cotton,Knit Half Sleeves Solid & Numerical Detailing Polo...,343.14,399,15% Off,335.16
Added to Cart | Shortlisted | Already Viewed,Pine Kids Swimming,Trunks Marble Print - Blue,402.36,479,16% Off,392.78
Added to Cart | Shortlisted | Already Viewed,Pine Kids Baseball,Shimmered Cap with Flamingo Applique - Purple,524.87,719,40% Off,510.49
Added to Cart | Shortlisted | Already Viewed,Honeyhap Premium Cotton,Jersey Knit Half Sleeves Top & Trouser Set...,594.15,699,15% Off,594.15
Added to Cart | Shortlisted | Already Viewed,Honeyhap Premium Cotton,Elastane Sleeveless Vests With Bio Finish...,521.13,599,22% Off,509.15
Added to Cart | Shortlisted | Already Viewed,Honeyhap Premium Cotton,Elastane Knit Sleeveless Vests With Bio...,521.13,599,22% Off,509.15
Added to Cart | Shortlisted | Already Viewed,Honeyhap Premium Cotton,Elastane Knit Sleeveless Vests With Bio...,521.13,599,22% Off,509.15
Added to Cart | Shortlisted | Already Viewed,Honeyhap Premium Cotton,Spandex Knit Sleeveless Vests With Bio Finish...,521.13,599,13% Off,509.15
Added to Cart | Shortlisted | Already Viewed,Honeyhap Premium Cotton,Spandex Knit Sleeveless Vests With Bio Finish...,521.13,599,13% Off,509.15
Added to Cart | Shortlisted | Already Viewed,Honeyhap Premium,100% Cotton Knit Half Raglan Sleeves T-Shit with...,521.13,599,13% Off,509.15
Added to Cart | Shortlisted | Already Viewed,Honeyhap Premium,100% Cotton Knit Half Sleeves Striped T-Shirts...,466.65,549,15% Off,455.67
Added to Cart | Shortlisted | Already Viewed,Honeyhap Premium,100% Cotton Knit Half Sleeves T-Shirts with Bio...,477.63,549,13% Off,466.65
Added to Cart | Shortlisted | Already Viewed,Honeyhap Premium,100% Cotton Knit Half Raglan Sleeves Cut & Sew...,521.13,599,13% Off,509.15
Added to Cart | Shortlisted | Already Viewed | 2 Left,Premium Honeyhap Premium,Cotton Knit Half Sleeves Bio Finish Night Suit...,591.71,749,28% Off,576.73
Added to Cart | Shortlisted | Already Viewed,Honeyhap Premium Cotton,Knit Full Raglan Sleeves Night Suit with...,608.13,699,13% Off,594.15
Added to Cart | Shortlisted | Already Viewed,Honeyhap Premium,100% Cotton Knit Half Sleeves Shorts Night Suit...,521.13,599,13% Off,509.15
Added to Cart | Shortlisted | Already Viewed,Honeyhap Premium Cotton,Elastane Bio Finish Sleeveless Solid Color...,315.21,399,21% Off,307.23
Added to Cart | Shortlisted | Already Viewed,Honeyhap Premium Cotton,Knit Half Sleeves Rainbow Printed Night...,545.16,649,21% Off,532.18
Added to Cart | Shortlisted | Already Viewed,Honeyhap Premium Cotton,Knit Full Sleeves Night Suit with Bio...,587.16,699,21% Off,573.18
Added to Cart | Shortlisted | Already Viewed,Honeyhap Premium,100% Cotton Knit Sleeveless Tank T-Shirts with Bio...,461.16,549,21% Off,450.18
Added to Cart | Shortlisted | Already Viewed,Honeyhap Premium,100% Cotton Knit Half Sleeves Tops with Bio Finish...,461.16,549,21% Off,450.18
Added to Cart | Shortlisted | Already Viewed,Honeyhap Premium,emium Cotton Elastane Knit Panties With Floral...,506.22,649,34% Off,493.24
Added to Cart | Shortlisted | Already Viewed,Honeyhap Premium Cotton,Elastane Knit Panties With Polka Dots &...,354.71,449,30% Off,345.73
Added to Cart | Shortlisted | Already Viewed,OLLINGTON ST. Cotton,Half Sleeves Printed Shirt & Knit Shorts with...,779.22,999,22% Off,759.24
Added to Cart | Shortlisted | Already Viewed,OLLINGTON ST. Cotton-Lycra,Floral Printed Co-ord Set of Sleeveless...,779.22,999,22% Off,759.24
Added to Cart | Shortlisted | Already Viewed,Ollington St. Cotton,Knit Half Sleeves Floral Printed Top &...,857.22,1099,23% Off,835.24
Added to Cart | Shortlisted | Already Viewed,Ollington St. Cotton,Knit Printed Polo T-Shirt & Stretchable Denim...,857.22,1099,23% Off,835.24
Added to Cart | Shortlisted | Already Viewed,Ollington St. Cotton,Half Sleeves Boat Printed T-Shirt & Woven...,779.22,999,22% Off,759.24
Added to Cart | Shortlisted | Already Viewed,Ollington St. Sinker,Knit Half Sleeves Shirt & Shorts Sets With...,857.22,1099,23% Off,835.24
Added to Cart | Shortlisted | Already Viewed,OLLINGTON ST.,100% Cotton Striped Polo T-Shirt - Multicolor,437.27,599,27% Off,425.29
Added to Cart | Shortlisted | Already Viewed | 3 Left,Ollington St. Cotton,Knit Floral Printed Co-Ord Set of Half...,779.22,999,22% Off,759.24
Added to Cart | Shortlisted | Already Viewed,Ollington St. Cotton,Half Sleeves Printed Hoodie T-Shirt & Joggers...,710.21,899,22% Off,692.23
Added to Cart | Shortlisted | Already Viewed,Ollington St. Cotton,Half Sleeves Printed Shirt & Twill Lycra...,923.23,1199,23% Off,899.25
Added to Cart | Shortlisted | Already Viewed,Ollington St. Cotton,Half Sleeves Printed T-Shirt & Denim Joggers...,923.23,1199,23% Off,899.25
Added to Cart | Shortlisted | Already Viewed,Ollington St. Cotton,Half Sleeves Polo T-Shirt & Shorts With Surf...,631.21,799,21% Off,615.23
Added to Cart | Shortlisted | Already Viewed,Ollington St. Cotton,Knit Half Sleeves Smiley Print T-Shirt &...,1000.23,1299,24% Off,974.25
Added to Cart | Shortlisted | Already Viewed,Ollington St. Cotton,Knit Half Sleeves T-Shirt & Denim Joggers...,911.24,1199,24% Off,887.26
Added to Cart | Shortlisted | Already Viewed,Ollington St. Cotton,Half Sleeves Printed Shirt & Shorts Set -...,631.21,799,21% Off,615.23
Added to Cart | Shortlisted | Already Viewed,Ollington St. Cotton,Half Sleeves Floral Printed Shirt & Shorts Set...,710.21,899,22% Off,692.23
Added to Cart | Shortlisted | Already Viewed,Ollington St. Cotton,Knit Half Sleeves Leaf Printed Shirt &...,857.22,1099,23% Off,835.24
Added to Cart | Shortlisted | Already Viewed,Ollington St. Cotton,With Jungle Print & Travel for Fun Text Print...,779.22,999,22% Off,759.24
Added to Cart | Shortlisted | Already Viewed,Ollington St. Cotton,Half Sleeves Printed T-Shirt & Knit Shorts Set...,631.21,799,21% Off,615.23
Added to Cart | Shortlisted | Already Viewed,Ollington St. Cotton,Printed Half Sleeves Shirt & Knit Shorts...,710.21,899,22% Off,692.23
Added to Cart | Shortlisted | Already Viewed,Mother Sparsh Milky,"Soft Daily Moisturizing Baby... 0 Months+, The Boosting Hydration of Milk Protein, Shea Butter & Coconut... (395 Ratings)  ADD TO CART",153.75,375,59% Off,146.25
Added to Cart | Shortlisted | Already Viewed,Babyhug Milk Protein,"Formula Daily Moisturising Milky... 0 Months+, mild, gentle, dermatologically tested, keeps baby's delicate... (21.7k Ratings)  (0.55 Per ml) ADD TO CART",219.45,399,45% Off,211.47
Added to Cart | Shortlisted | Already Viewed,Bestseller Babyhug Advanced,"Mineral Based Sunscreen with SPF 30 +... 0 Months + , This sunscreen is dermatologically tested and also it dosen't... (3249 Ratings)  (2.59 Per g) ADD TO CART",258.75,345,25% Off,248.4
Added to Cart | Shortlisted | Already Viewed,mamaearth Soothing Massage,"Oil For Babies - 100 ml 0 to 5 Years, 100% natural, Cold pressed Sesame oil, coconut, olive, sweet... (3487 Ratings)  (2.33 Per ml) ADD TO CART",233.22,299,22% Off,227.24
Added to Cart | Shortlisted | Already Viewed,Babyhug Advanced Mineral,"Based Sunscreen with SPF 30 +... 0 Months + , This sunscreen is dermatologically tested and also it dosen't... (3249 Ratings)  (2.73 Per g) ADD TO CART",136.5,195,30% Off,130.65
Added to Cart | Shortlisted | Already Viewed,Bestseller Premium Cetaphil,"Baby Daily Lotion With Shea Butter - 400ml 0 Months+, Shea butter & Glycerin blend to moisturise and protect Baby's... (21.0k Ratings)  ADD TO CART",809.1,870,7% Off,791.7
Added to Cart | Shortlisted | Already Viewed,Babyhug Advanced Infused,"Hibiscus Hair Oil- 200 ml 0 to 3 Years, Aids in growth of healthier hair (1114 Ratings)  (1.38 Per ml) ADD TO CART",276.5,395,30% Off,268.6
Added to Cart | Shortlisted | Already Viewed,Bestseller Premium Aveeno,"Baby Daily Moisturising Lotion for Delicate... With oat flour, glycerin, and dimethicone Hypoallergenic, fragrance-free,... (7062 Ratings)  (3.2 Per g) ADD TO CART",727.5,970,25% Off,708.1
Added to Cart | Shortlisted | Already Viewed,Babyhug Advanced Talc-Free,"Dusting Powder - 400 gm 0 to 5 Years,Babyhug dusting powder is formulated with natural extracts... (14.7k Ratings)  (0.28 Per g) ADD TO CART",113.75,325,65% Off,107.25
Added to Cart | Shortlisted | Already Viewed,Premium Chicco Baby,"Moments Body Lotion - 500 ml 0 to 24 Months, This New Baby Moments Body Lotion has an Advanced formula... (3534 Ratings)  ADD TO CART",516.04,679,24% Off,502.46
Added to Cart | Shortlisted | Already Viewed,Bestseller Premium Figaro,"Baby Massage Oil - 400 ml 0 to 24 Months Enriching Qualities Of Olives Oils, Vitamin E And The... (8998 Ratings)  (1.08 Per ml) ADD TO CART",433.38,699,38% Off,419.4
Added to Cart | Shortlisted | Already Viewed,Babyhug Milk Protein,"Formula Daily Moisturising Milky... 0 Months+, mild, gentle, dermatologically tested, keeps baby's delicate... (21.7k Ratings)  (0.62 Per ml) ADD TO CART",123.38,199,38% Off,113.43
Added to Cart | Shortlisted | Already Viewed,Bestseller Little Rituals,"Organic Baby Sun Screen SPF 50+ with... 3 Months +, Made with RayBlock WiFi Defense SWISS Techonology, Organic... (335 Ratings)  ADD TO CART",867.65,1295,33% Off,841.75
Added to Cart | Shortlisted | Already Viewed,Aveeno Baby Daily,"Moisture Lotion with Oat Flour &... With oat flour, glycerine, and dimethicone Hypoallergenic, fragrance-free,... (396 Ratings)  (5.22 Per g) ADD TO CART",522.5,550,5% Off,511.5
Added to Cart | Shortlisted | Already Viewed,Mother Sparsh Baby,"Cold Pressed Coconut Oil - 200 ml 0 to 24 Months, Moisturising Properties: Our Coconut Oil is 100% Pure Cold... (392 Ratings)  ADD TO CART",263.34,399,34% Off,255.36
Added to Cart | Shortlisted | Already Viewed,Babyhug Milk Protein,"Formula Daily Full Body and Face... 0 Months +, Extra gentle cream that keeps baby's skin soft, supple and... (13.4k Ratings)  (1.15 Per ml) ADD TO CART",115.42,199,42% Off,105.47
Added to Cart | Shortlisted | Already Viewed,Bestseller Premium Cetaphil,"Baby Advanced Protection Cream - 85 gm 3 Year +,Contains soothing organic Calendula extract. (3754 Ratings)  (7.3 Per g) ADD TO CART",620.1,689,10% Off,606.32
Added to Cart | Shortlisted | Already Viewed,Bestseller Premium Aveeno,"Baby Soothing Relief Moisture Cream - 227g 24-Hour Protection for Dry, Itchy or Sensitive Skin Clinically Proven... (4205 Ratings)  (3.94 Per g) ADD TO CART",893.89,1259,29% Off,868.71
Added to Cart | Shortlisted | Already Viewed,Mom's Pick Babyhug,"Milk Protein Formula Daily Full Body and Face... 0 Months +, Extra gentle cream that keeps baby's skin soft, supple and... (13.4k Ratings)  (1.31 Per ml) ADD TO CART",65.4,109,40% Off,59.95
Added to Cart | Shortlisted | Already Viewed,Himalaya Herbal Baby,"Cream - 200 ml Soft cream infused with the power of herbs, Vitamin E, bala and Licorice... (21.4k Ratings)  ADD TO CART",218.4,280,22% Off,204.4
Added to Cart | Shortlisted | Already Viewed,Bestseller Premium Baby,"Sebamed Protective Facial Cream|pH 5.5|Baby Face... 12 Months to 3 Years, Vitamin E safeguards against harmful environmental... (5148 Ratings)  (14.15 Per ml) ADD TO CART",1415.5,1490,5% Off,1385.7
Added to Cart | Shortlisted | Already Viewed,Premium Chicco Baby,"Cream Natural Sensation - 50 ml With Shea Butter and Vitamin E, long lasting hydration (1161 Ratings)  (12.14 Per ml) ADD TO CART",607.24,799,24% Off,591.26
Added to Cart | Shortlisted | Already Viewed,Babyhug Pro,"pH 5.5 Deep Moisture Face Cream Pack of 2... 0 to 24 months, Quick absorption & it makes skin soft & smooth (7 Ratings)  ADD TO CART",338.56,1058,68% Off,317.4
Added to Cart | Shortlisted | Already Viewed,Bestseller Premium Baby,"Sebamed Cream Extra Soft|pH 5.5|Ideal for Dry... 200 ml, Soothes and regenerates irritated skin (21.4k Ratings)  ADD TO CART",788.5,830,5% Off,771.9
Added to Cart | Shortlisted | Already Viewed,Aveeno Baby Dermexa,"Cream - 206 g 0 Months+, Clinically proven to reduce the itching and irritation caused... (433 Ratings)  (5.17 Per g) ADD TO CART",1064.29,1499,29% Off,1034.31
Added to Cart | Shortlisted | Already Viewed,Babyhug Advanced Sensitive,"Peach Milk Butter - 200 g,... 0 Months+, Mild,Dermatologically tested, Gentle Care for Sensitive Skin,... (898 Ratings)  (1.11 Per g) ADD TO CART",222.75,495,55% Off,212.85
Added to Cart | Shortlisted | Already Viewed,Chicco Baby Moments,"Baby Cream - 200 g 0 months+, Dermatologically tested, it ensures safe, daily nourishment for... (64 Ratings)  (1.46 Per g) ADD TO CART",291.83,379,23% Off,284.25
Added to Cart | Shortlisted | Already Viewed,Mustela Hydra Baby,"Facial Cream - 40 ml 0 to 3 Years, Leaves the skin soft, supple and delicately scented. (1210 Ratings)  (10.43 Per ml) ADD TO CART",417.3,535,22% Off,406.6
Added to Cart | Shortlisted | Already Viewed,Babyhug Pro Deep,"Moisture Honey & Organic Beeswax Lip... 6 Months to 5 Years, Lip balm is made with all-natural & nourishing... (402 Ratings)  ADD TO CART",284.4,395,28% Off,276.5
Added to Cart | Shortlisted | Already Viewed,Premium MAATE Baby,Face Butter - 50 gm Rich with antioxidants and antibacterial properties (634 Ratings)  (12.35 Per g) ADD TO CART,617.5,650,5% Off,604.5
Added to Cart | Shortlisted | Already Viewed,Curatio Atogla Moisturizing,"Baby Cream - 100 g 0 Months+, Dermatologically tested, Paraben Free Formulation (761 Ratings)  (3.7 Per g) ADD TO CART",369.55,389,5% Off,361.77
Added to Cart | Shortlisted | Already Viewed,Bestseller Baby Forest,Khilta Mukhra Baby Face Cream - 50 gm Almond oil helps soothe irritation while protecting skin from UV radiation (401 Ratings)  ADD TO CART,715.5,795,10% Off,699.6
Added to Cart | Shortlisted | Already Viewed,Bestseller Babyhug Cotton,"Bedding Set with Mosquito Net Animal... 0 to 9 months, L 90 x B 60 x H 40 cm, foldable, lightweight, easy to... (389 Ratings)  Sizes: L 90 x B 60 x H 40 cm Sizes: L 90 x B 60 x H 40 cm ADD TO CART",929.38,1499,38% Off,899.4
Added to Cart | Shortlisted | Already Viewed,Bestseller Save W/,"Coupon Babyhug Premium Bedding Super Saver Combo Set of 3... 0 to 6 Months, L 90 x B 60 x H 46 cm, combo gadda set in attractive print... (630 Ratings)  Sizes: L 90 x B 60 x H 46 cm Sizes: L 90 x B 60 x H 46 cm Sizes: L 90 x B 60 x H 46 cm ADD TO CART",2479.38,3999,43% Off,2399.4
Added to Cart | Shortlisted | Already Viewed,Today's Deal LifeKrafts,"Baby Foldable Mosquito Net - Green 0 to 24 Months, L 135 x B 65 x H 65 cm, mesh fabric used in the net... (2683 Ratings)  Sizes: EFB9C4 Sizes: L 110 x B 60 x H 55 cm Sizes: L 135 x B 65 x H 65 cm Sizes: L 135 x B 65 x H 65 cm Sizes: L 135 x B 65 x H 65 cm ADD TO CART",876.96,1050,16% Off,855.96
Added to Cart | Shortlisted | Already Viewed,Kolar Bottomless Mosquito,"Net for Babies Portable... 0-2.5 years onwards, L 94 x B 76 xH 81 cm; Kolar Premium Mosquito Net for... (27 Ratings)  Sizes: L 94 x B 76 x H 81 cm Sizes: L 94 x B 76 x H 81 cm ADD TO CART",495.2,1000,50% Off,475.2
Added to Cart | Shortlisted | Already Viewed,Bestseller Babyhug Premium,"Bedding Super Save Combo Set of 3 Duck... 0 to 6 Months, L 90 x B 60 x H 46 cm, combo gadda set in attractive print... (630 Ratings)  Sizes: L 90 x B 60 x H 46 cm Sizes: L 90 x B 60 x H 46 cm Sizes: L 90 x B 60 x H 46 cm ADD TO CART",2279.43,3999,43% Off,2199.45
Added to Cart | Shortlisted | Already Viewed,Vparents Joy Jumbo,"Extra Large Baby Bedding Set With... 0 to 18 Months, L 111 x B 42 x H 96 cm, safe, comfortable and cozy... (94 Ratings)  Sizes: L 111 x B 42 x H 96 cm Sizes: L 111 x B 42 x H 96 cm Sizes: L 111 x B 42 x H 96 cm ADD TO CART",919.27,1599,43% Off,919.27
Added to Cart | Shortlisted | Already Viewed,Bestseller Babyhug Premium,"Bedding Super Saver Combo Jungle Print... 0 to 6 Months,L 90 x B 60 cm, combo gadda set for your baby's comfortable... (417 Ratings)  Sizes: L 63 X B 19 X H 50.5 cm Sizes: L 63 X B 19 X H 50.5 cm Sizes: L 63 X B 19 X H 50.5 cm ADD TO CART",2357.05,3995,44% Off,2277.15
Added to Cart | Shortlisted | Already Viewed,Bestseller Babyhug Foldable,"Mosquito Net Large Size Bear Theme -... 0 to 24 Months, L 135 x B 65 X H 65 cm, Made of breathable fabric which... (396 Ratings)  Sizes: C 135 x D 65 X H 65 cm Sizes: L 135 x B 65 X H 65 cm Sizes: L 135 x B 65 X H 65 cm ADD TO CART",825.41,1399,43% Off,797.43
Added to Cart | Shortlisted | Already Viewed,Bestseller Babyhug Foldable,"Mosquito Net Large Size Bunny Theme -... 0 to 24 Months, L 135 x B 65 X H 65 cm, Made of breathable fabric which... (396 Ratings)  Sizes: C 135 x D 65 X H 65 cm Sizes: L 135 x B 65 X H 65 cm Sizes: L 135 x B 65 X H 65 cm ADD TO CART",825.41,1399,43% Off,797.43
Added to Cart | Shortlisted | Already Viewed,Babyhug Premium Bedding,"Super Saver Combo Set of 3... 0 to 6 Months, L 90 x B 60 x H 46 cm, combo gadda set in attractive print... (630 Ratings)  Sizes: L 90 x B 60 x H 46 cm Sizes: L 90 x B 60 x H 46 cm Sizes: L 90 x B 60 x H 46 cm ADD TO CART",3719.07,3999,43% Off,3639.09
Added to Cart | Shortlisted | Already Viewed,Bestseller Babyhug Foldable,"Printed Mosquito Net Large Size... 0 to 24 Months, C 135 x D 65 X H 65 cm Made of breathable fabric which... (396 Ratings)  Sizes: C 135 x D 65 X H 65 cm Sizes: L 135 x B 65 X H 65 cm Sizes: L 135 x B 65 X H 65 cm ADD TO CART",797.43,1399,43% Off,769.45
Added to Cart | Shortlisted | Already Viewed,Premium Baby Jalebi,"The Sleep Cloud Personalised Nest With... 0 to 12 Months, L 90 x B 45 x H 15 cm, Light Ergonomic design , easy for... (11 Ratings)  Sizes: L 90 x B 45 x H 15 cm Sizes: L 90 x B 45 x H 15 cm Sizes: L 90 x B 45 x H 15 cm Sizes: L 90 x B 45 x H 15 cm ADD TO CART",14685.27,19999,27% Off,14285.29
Added to Cart | Shortlisted | Already Viewed | 1 Left,Babyhug Foldable Printed,"Mosquito Net Small Size... 0 to 12 Months, C 98 x D 50 X H 55 cm Made of breathable fabric which... (245 Ratings)  Sizes: C 98 x D 50 X H 55 cm Sizes: L 98 x B 50 X H 55 cm Sizes: L 98 x B 50 X H 55 cm ADD TO CART",683.43,1199,43% Off,659.45
Added to Cart | Shortlisted | Already Viewed,Babyhug Foldable Mosquito,"Net Small Size Bunny Theme -... 0 to 12 Months, L 98 x B 50 X H 55 cm, Made of breathable fabric which... (245 Ratings)  Sizes: C 98 x D 50 X H 55 cm Sizes: L 98 x B 50 X H 55 cm Sizes: L 98 x B 50 X H 55 cm ADD TO CART",743.38,1199,43% Off,719.4
Added to Cart | Shortlisted | Already Viewed,Today's Deal LifeKrafts,Foldable Baby Mosquito Net Bottomless - Grey LifeKrafts Foldable Baby Mosquito Net Grey. (2683 Ratings)  Sizes: EFB9C4 Sizes: L 110 x B 60 x H 55 cm Sizes: L 135 x B 65 x H 65 cm Sizes: L 135 x B 65 x H 65 cm Sizes: L 135 x B 65 x H 65 cm ADD TO CART,876.96,1050,16% Off,855.96
Added to Cart | Shortlisted | Already Viewed,Coupon Inside Babyhug,"Portable Baby Mosquito Net Large - Green 0 Months+, 120 X 78 X 40 cm , Made of soft and skin friendly fabric,... (4113 Ratings)  Sizes: 120 X 78 X 40 cm Sizes: 120 X 78 X 40 cm Sizes: 120 X 78 X 40 cm Sizes: 128 X 78 X 40 cm ADD TO CART",813.75,875,38% Off,796.25
Added to Cart | Shortlisted | Already Viewed,Mi Arcus Soft,"Printed Foldable Mattress Set with... 0 to 12 Months, L 102 x 54 cm, Soft Cottony Material for baby's soft skin (56 Ratings)  Sizes: L 102 x 54 cm Sizes: L 102 x 54 cm Sizes: L 102 x 54 cm Sizes: L 102 x B 54 cm Sizes: L 102 x B 54 cm ADD TO CART",1268.45,1499,15% Off,1268.45
Added to Cart | Shortlisted | Already Viewed,LuvLap Baby Bed,"with Thick Mattress, Mosquito Net with... 0 Months+, L 75 x B 40 x H 40 cm, Compact & foldable, the mosquito net... (389 Ratings)  Sizes: L 75 x B 40 x H 40 cm Sizes: L 75 x B 40 x H 40 cm Sizes: L 75 x B 43 x H 36 cm Sizes: L 75 x B 48 cm Sizes: L 75 x B 48 cm ADD TO CART",599.02,689,13% Off,599.02
Added to Cart | Shortlisted | Already Viewed,Bestseller Save W/,"Coupon Babyhug Symphony Stroller With Reverisble Handle &... 0 to 3 Years, L 92 x W 52 x H 111 cm, carrying capacity 20 kg, comfortable... (4201 Ratings)  Sizes: L 92 x W 52 x H 111 cm Sizes: L 92 x W 52 x H 111 cm Sizes: L 92 x W 52 x H 111 cm Sizes: L 92 x W 52 x H 111 cm Sizes: L 92 x W 52 x H 111 cm ADD TO CART",4156.8,6495,48% Off,4026.9
Added to Cart | Shortlisted | Already Viewed,Bestseller R,"for Rabbit Street Smart Auto Fold Stylish Newborn... 0 to 3 Years, L 72 x B 40 x H 108 cm, Carrying Capacity 20 kg, Simple... (84 Ratings)  Sizes: L 72 x B 40 x H 108 cm Sizes: L 72 x B 40 x H 108 cm Sizes: L 72 x B 40 x H 108 cm ADD TO CART",9296.48,11997,23% Off,9296.48
Added to Cart | Shortlisted | Already Viewed,LuvLap Galaxy Baby,"Stroller with 5-Point Safety... 6 Months to 3 Years, 78 x 54.2 x 26 cm, carrying capacity 15 kg,Stroller... (881 Ratings)  Sizes: 78 x 54.2 x 26 cm Sizes: 78 x 54.2 x 26 cm ADD TO CART",5779.18,8799,34% Off,5779.18
Added to Cart | Shortlisted | Already Viewed,Coupon Inside Babyhug,"Cocoon Stroller With Mosquito Net & Reversible... 0 to 3 Years, L 65 x B 53 x H 98 cm , Carry Capacity up to 25 Kgs,... (4713 Ratings)  Sizes: L 65 x B 53 x H 98 cm Sizes: L 65 x B 53 x H 98 cm Sizes: L 65 x B 53 x H 98 cm Sizes: L 65 x B 53 x H 98 cm ADD TO CART",3022.25,5495,46% Off,2912.35
Added to Cart | Shortlisted | Already Viewed,Coupon Inside R,"for Rabbit Premium Chocolate Ride Stylish Baby... 0 to 3 Years, L 53 x B 69 x H 102 cm, Carry capacity upto 20 kg, Simple... (1343 Ratings)  Sizes: L 66 x B 52.5 x H 105.5 cm Sizes: 69 x 53 x 102 cm Sizes: L 53 x B 69 x H 102 cm Sizes: L 69 x B 53 x H 100 cm ADD TO CART",10008.18,10998,9% Off,10008.18
Added to Cart | Shortlisted | Already Viewed,Bestseller Lightweight,"& Compact Tour Infant Travel Stroller -... 0 to 3 Years, L 69 x B 47 x H 101 cm, carry capacity 15 kg, Lightweight... (22 Ratings)  Sizes: L 69 x B 47 x H 101 cm Sizes: L 69 x B 47 x H 101 cm Sizes: L 69 x B 47 x H 101 cm Sizes: L 69 x B 47 x H 101 cm ADD TO CART",2297.5,4595,50% Off,2205.6
Added to Cart | Shortlisted | Already Viewed | 3 Left,BAYBEE Infant Baby,"Pram Stroller for Newborn Babies... 0 to 3 Years, L 82 x W 42 x H 104 cm, Carry Capacity 20 Kg, Baby Pram...  Sizes: L 82 x B 42 x H 104 cm Sizes: L 82 x B 42 x H 104 cm ADD TO CART",9179.46,16999,46% Off,9179.46
Added to Cart | Shortlisted | Already Viewed,Bestseller Premium Bonfino,"Runway Cabin Stroller in Linen Fabric - Beige 0 to 3 Years, L 67.5 B 49 x H 100 cm, Carrying Capacity 15 Kg, Five point... (50 Ratings)  Sizes: L 67.5 B 49 x H 100 cm Sizes: L 67.5 B 49 x H 100 cm ADD TO CART",12701.15,16495,23% Off,12371.25
Added to Cart | Shortlisted | Already Viewed,LuvLap Galaxy Baby,"Stroller with 5-Point Safety... 6 Months to 3 Years, 78 x 54.2 x 26 cm, carrying capacity 15 kg,Stroller... (881 Ratings)  Sizes: 78 x 54.2 x 26 cm Sizes: 78 x 54.2 x 26 cm ADD TO CART",5779.18,8799,34% Off,5779.18
Added to Cart | Shortlisted | Already Viewed,Bestseller Coupon Inside,"Babyhug Symphony Stroller With Reverisble Handle &... 0 to 3 Years, L 92 x W 52 x H 111 cm, carrying capacity 20 kg, comfortable... (4201 Ratings)  Sizes: L 92 x W 52 x H 111 cm Sizes: L 92 x W 52 x H 111 cm Sizes: L 92 x W 52 x H 111 cm Sizes: L 92 x W 52 x H 111 cm Sizes: L 92 x W 52 x H 111 cm ADD TO CART",4156.8,6495,48% Off,4026.9
Added to Cart | Shortlisted | Already Viewed,Bestseller Chicco Bravo,"Trio Travel System Camden USA - Black 0 Months+, L 60.9 x B 48.4 x H 74.5 cm Carrying Capacity 22 Kg The Bravo... (3 Ratings)  ADD TO CART",33742.5,44990,25% Off,32842.7
Added to Cart | Shortlisted | Already Viewed,Coupon Inside R,"for Rabbit Pocket Stroller Lite Baby Stroller,... 0 to 3 Years, L 72 x B 35 x H 103 cm, Every minor point from safety to... (633 Ratings)  Sizes: L 72 x B 35 x H 103 cm Sizes: L 72 x B 35 x H 103 cm Sizes: L 73 x B 36 x H 103 cm ADD TO CART",7690.41,8451,9% Off,7690.41
Added to Cart | Shortlisted | Already Viewed,Premium Travel Lite,"Stroller SLD by Teknum - Newton 0 to 3 Years, Unfolded Dimension L 41 x B 85 x H 105 cm, This Lightweight... (6 Ratings)  Sizes: L 41 x B 85 x H 105 cm Sizes: L 41 x B 85 x H 105 cm Sizes: L 41 x B 85 x H 105 cm ADD TO CART",7998.97,14999,47% Off,7998.97
Added to Cart | Shortlisted | Already Viewed | 3 Left,Joie Mirus Stroller,"with Reversible Handle - Grey 0 to 3 Years, L 79 x B 48 x H 101 cm, Carrying Capacity - 15 kg, Sleek and...  ADD TO CART",17479.08,18999,8% Off,17099.1
Added to Cart | Shortlisted | Already Viewed,Coupon Inside R,"for Rabbit Pocket Stroller Lite Stroller for Kids |... 0 to 3 Years, L 72 x B 35 x H 103 cm, Every minor point from safety to... (633 Ratings)  Sizes: L 72 x B 35 x H 103 cm Sizes: L 72 x B 35 x H 103 cm Sizes: L 73 x B 36 x H 103 cm ADD TO CART",7690.41,8451,9% Off,7690.41
Added to Cart | Shortlisted | Already Viewed,2,"in 1 Baby Bouncer Newborn to Toddler Rocker Cum... 0 to 12 Months, Carrying Capacity- 18 kg, A 2 in 1 Toddler Rocker cum... (26 Ratings)  ADD TO CART",2922.75,6495,55% Off,2792.85
Added to Cart | Shortlisted | Already Viewed,Today's Deal INFANTSO,"Baby Rocker Portable with Free Mosquito Net &... 0 to 24 Months, L 52 x B 38 x H 8 cm, Carrying Capacity 18 kg, Convenient... (592 Ratings)  Sizes: L 52 x B 38 x H 8 cm Sizes: L 52 x B 38 x H 8 cm Sizes: L 52 x B 38 x H 8 cm Sizes: L 67 x B 45 x H 55 cm ADD TO CART",3870.2,5499,30% Off,3870.2
