Status,Brand,Title,Discounted Price,Original Price,Discount Percent,Club Price
Added to Cart | Shortlisted | Already Viewed,TOYPENTER Layers,"rs High Density Plastic Storage... 6 Drawers ( 4 Big Drawers, 2 Small Drawers) with secure lock system, Easy... (2 Ratings)  ADD TO CART",7156.5,13000,45% Off,7156.5
Added to Cart | Shortlisted | Already Viewed,Bestseller R,"for Rabbit Little Genius Learner Kids Study Table... 2 to 10 Years, L 67 x B 36 x H 57 cm, Carrying Capacity 45 kg, Encourage... (171 Ratings)  Sizes: L 56 x B 56 x H 89 cm Sizes: L 65 x B 53 x H 49 cm Sizes: L 67 x B 36 x H 57 cm ADD TO CART",5595.8,6993,21% Off,5595.8
Added to Cart | Shortlisted | Already Viewed,Bestseller Coupon Inside,"Study Table & Chair Set with Height Adjustment - Blue 3 to 15 years, L 70 x B 45 x H 70 cm, Encourage inclination towards... (793 Ratings)  Sizes: 22,22,22 Sizes: L 70 x B 45 x H 70 cm Sizes: L 70 x B 45 x H 70 cm ADD TO CART",3637.4,6995,48% Off,3497.5
Added to Cart | Shortlisted | Already Viewed,SYGA Kids Height,"Adjustable Desk and Chair Set Study... 3 to 15 Years, Table dimensions L 70 x B 46 x H 40 cm, Chair dimensions -... (211 Ratings)  Sizes: L 70 x B 46 x H 40 cm Sizes: L 70 x B 53 x H 58 cm ADD TO CART",4339.38,6999,38% Off,4199.4
Added to Cart | Shortlisted | Already Viewed,Babyhug Junior Study,"Kids Study Table and Chair Set... 2 to 10 Years, L 66 x B 26 x H 51.5 cm, Carrying Capacity 45 kg, It comes... (3 Ratings)  ADD TO CART",3297.25,5995,45% Off,3177.35
Added to Cart | Shortlisted | Already Viewed,Bestseller Babyhug Giraffe,"Shaped Soft Seat - Brown(Color May... 12 Months to 3 Years, L 45.5 x B 41 x H 39 cm, Light weight and... (80 Ratings)  ADD TO CART",1354.05,2295,41% Off,1308.15
Added to Cart | Shortlisted | Already Viewed,Baybee Little Genius,"Learner Kids Study Table Set With... 2 to 8 Years, L 67 x B 36 x H 57 cm, 4-in-1 foldable kids' study table...  ADD TO CART",4769.52,9999,52% Off,4769.52
Added to Cart | Shortlisted | Already Viewed,Bestseller Coupon Inside,"Study Table & Chair Set with Height Adjustment - Pink 3 to 15 Years, L 70 x B 45 x H 70 cm,Chair and table set to help your kid... (793 Ratings)  Sizes: 22,22,22 Sizes: L 70 x B 45 x H 70 cm Sizes: L 70 x B 45 x H 70 cm ADD TO CART",3637.4,6995,48% Off,3497.5
Added to Cart | Shortlisted | Already Viewed,SYGA Kids Height,"Adjustable Desk and Chair Set Study... 3 to 15 Years, Table dimensions L 70 x B 53 x H 58 cm Premium quality... (211 Ratings)  Sizes: L 70 x B 46 x H 40 cm Sizes: L 70 x B 53 x H 58 cm ADD TO CART",4339.38,6999,38% Off,4199.4
Added to Cart | Shortlisted | Already Viewed,Bestseller Babyhug Study,"Table & Chair Set with Height Adjustment... 3 to 15 Years, L 70 x B 45 x H 70 cm,Chair and table set to help your kid... (227 Ratings)  Sizes: L 70 x B 45 x H 70 cm Sizes: L 70 x B 45 x H 70 cm ADD TO CART",6505.35,6995,7% Off,6365.45
Added to Cart | Shortlisted | Already Viewed,Babyhug Study Table,"& Chair Set with Height Adjustment... 3 to 15 years, L 70 x B 45 x H 70 cm, Encourage inclination towards... (227 Ratings)  Sizes: L 70 x B 45 x H 70 cm Sizes: L 70 x B 45 x H 70 cm ADD TO CART",6505.35,6995,7% Off,6365.45
Added to Cart | Shortlisted | Already Viewed,Multifunctional Block Table,"and Chair Set - Multicolour 3 to 8 Years, L 91 x B 67 x H 56.5 cm,Carrying Capacity 20 kgs, Smooth... (7 Ratings)  ADD TO CART",7366.65,10995,33% Off,7146.75
Added to Cart | Shortlisted | Already Viewed,R Rabbit,"bbit Little Genius Candy Easel Board Set with... 2 to 10 Years, L 51 X B 42 X H 86 cm, Carrying Capacity 40 kg Cute candy... (32 Ratings)  Sizes: L 51 X B 42 X H 86 cm Sizes: L 51 X B 42 X H 86 cm ADD TO CART",3996.12,5499,27% Off,3996.12
Added to Cart | Shortlisted | Already Viewed,Bestseller Coupon Inside,"Babyhug Kids Penguin Shaped Sofa Chair - Blue 12 Months to 3 Years, L 48 x B 48 x H 35 cm, Carrying capacity 15 kg,... (446 Ratings)  ADD TO CART",1855.35,1995,7% Off,1815.45
Added to Cart | Shortlisted | Already Viewed,Bestseller R,"for Rabbit Jelly Bean Chair 3 in 1 Multi-Functional... 6 Months to 7 Years, L 62 x B 60 x H 92 cm, Carrying Capacity 40 Kg,... (615 Ratings)  Sizes: L 46 x B 43 x H 46 cm Sizes: L 46 x B 43 x H 46 cm Sizes: L 46 x B 43 x H 46 cm Sizes: L 62 x B 60 x H 92 cm ADD TO CART",1179.36,1296,15% Off,1179.36
Added to Cart | Shortlisted | Already Viewed,R Rabbit,"bbit Jelly Bean Chair 3 in 1 Multi-Functional... 12 Months to 8 Years, L 46 x B 43 x H 46 cm, Carrying Capacity 40 Kg,... (615 Ratings)  Sizes: L 46 x B 43 x H 46 cm Sizes: L 46 x B 43 x H 46 cm Sizes: L 46 x B 43 x H 46 cm Sizes: L 62 x B 60 x H 92 cm ADD TO CART",1179.36,1296,15% Off,1179.36
Added to Cart | Shortlisted | Already Viewed,Coupon Inside Babyhug,"Giraffe Shaped Soft Seat - Blue 12 Months to 3 Years, L 43.5 x B 42 x H 41 cm, Light weight and... (534 Ratings)  Sizes: L 43.5 x B 42 x H 41 cm Sizes: L 55 x B 38 x H 50 cm Sizes: L 56 x B 44 x H 39 cm ADD TO CART",2134.35,2295,7% Off,2088.45
Added to Cart | Shortlisted | Already Viewed,New Maru,"& Sons 2 in 1 White Board Writing Table With... 3 Years+,L 60 x B 40 x H 32 cm , Study smart and play creative with the...  Sizes: L 60 x B 40 x H 32 cm Sizes: L 60 x B 40 x H 32 cm Sizes: L 60 x B 40 x H 32 cm Sizes: L 60 x B 40 x H 32 cm ADD TO CART",724.06,1299,44% Off,698.08
Added to Cart | Shortlisted | Already Viewed,Kids Multi Purpose,"Chair With Feeding Tray - Sea Green 12 Months to 4 Years, L 47 x B 35 x H 39 cm, Carrying Capacity 20 Kg, Ease... (1797 Ratings)  Sizes: L 35 x B 33 x H 39 cm Sizes: L 35 x B 33 x H 39 cm Sizes: L 35 x B 33 x H 39 cm Sizes: L 47 x B 35 x H 39 cm Sizes: L 47 x B 35 x H 39 cm ADD TO CART",576.45,945,39% Off,557.55
Added to Cart | Shortlisted | Already Viewed,Coupon Inside Babyhug,"Kids Lion Shaped Sofa Chair - Orange 12 Months to 3 Years, L 48 x B 48 x H 35 cm, Carrying capacity 15 kg,... (395 Ratings)  ADD TO CART",1855.35,1995,7% Off,1815.45
Added to Cart | Shortlisted | Already Viewed,Bestseller Coupon Inside,"Intelliskills Extra Large Reversible Carnival &... Ideal Age 0 to 4 Years, This Mat is a soft, foldable, reversible and... (6288 Ratings)  Sizes: L 6.5 x B 4.5 ft Sizes: L 6.5 x B 4.5 ft Sizes: L 6.5 x B 4.5 ft Sizes: L 6.5 x B 4.5 ft Sizes: L 6.5 x B 4.5 ft Sizes: L 6.5 x B 4.5 ft Sizes: L 6.5 x B 4.5 ft ADD TO CART",698.9,2299,80% Off,652.92
Added to Cart | Shortlisted | Already Viewed,Florida Cotton Single,"Bed All Season Reversible AC... 3 to 15 Years, L 220 x B 146 x H 2 cm, This Dohar has same fabric...  ADD TO CART",971.08,2999,68% Off,971.08
Added to Cart | Shortlisted | Already Viewed,Bestseller Babyhug Premium,"Reversible Foldable Waterproof Floor... Ideal Age 0 to 4 Years, Educational mat with stimulating and vibrant... (1849 Ratings)  Sizes: L 180 x B 120 cm Sizes: L 180 x B 150 cm ADD TO CART",685.97,1599,59% Off,653.99
Added to Cart | Shortlisted | Already Viewed,Today's Deal Glow,"in The Dark Unicorn and Fairy Blanket Bedroom... 3 to 15 Years, L 200 x B 150 cm, The Glowing blanket is made of... (333 Ratings)  Sizes: L 152.4 x B 127 cm Sizes: L 200 x B 150 cm ADD TO CART",924.63,2499,63% Off,874.65
Added to Cart | Shortlisted | Already Viewed,Filymore Dinasour Printed,"Single Bedsheet With 1... 3 to 15 Years, L 228 x B 152 cm, Soft and comfortable bedsheet for kids... (173 Ratings)  Sizes: L 228 x B 152 cm,L 228 x B 228 cm Sizes: L 228 x B 152 cm Sizes: L 228 x B 152 cm,L 228 x B 228 cm Sizes: L 228 x B 152 cm Sizes: L 228 x B 152 cm Sizes: L 228 x B 228 cm Sizes: L 228 x B 228 cm Sizes: L 228 x B 228 cm ADD TO CART",399.03,1199,67% Off,399.03
Added to Cart | Shortlisted | Already Viewed | 2 Left,Today's Deal Happy,"Hues Dinosaur Glow in The Dark Blanket Super... L 200 x B 150 cm, These blankets need to be exposed to sunlight or bright... (6 Ratings)  Sizes: L 200 x B 150 cm Sizes: L 200 x B 150 cm Sizes: L 200 x B 150 cm,L 200 x B 150 cm ADD TO CART",928.13,2499,63% Off,878.15
Added to Cart | Shortlisted | Already Viewed,Play Nation Premium,"Reversible Foldable Waterproof... Ideal age 0 to 24 Months, Safe and Non-toxic mat which is easy to maintain (577 Ratings)  Sizes: L 180 x B 120 cm Sizes: L 180 x B 150 cm ADD TO CART",671.58,1599,61% Off,639.6
Added to Cart | Shortlisted | Already Viewed,Today's Deal Babyhug,"Soft Touch Anti-Slip Rug with Space Theme... L 150 x B 120 cm, The design elements on the carpet are sharp, vivid, and... (1 Rating)  ADD TO CART",1253.43,2199,43% Off,1209.45
Added to Cart | Shortlisted | Already Viewed,Haus Kinder,"er Plain Brush Cloth Super Soft Plush... Dimension L 150 x B 110 cm, This blanket ensures your little one feels...  Sizes: L 150 x B 110 cm Sizes: L 150 x B 110 cm Sizes: L 150 x B 110 cm Sizes: L 150 x B 110 cm ADD TO CART",1002.41,1699,41% Off,1002.41
Added to Cart | Shortlisted | Already Viewed,Bestseller Coupon Inside,"Intelliskills 2 in 1 Play Mat Jungle & Roadmap Theme -... Ideal Age 0 to 4 Years, The mat is portable and easy to store. This mat... (6288 Ratings)  Sizes: L 6.5 x B 4.5 ft Sizes: L 6.5 x B 4.5 ft Sizes: L 6.5 x B 4.5 ft Sizes: L 6.5 x B 4.5 ft Sizes: L 6.5 x B 4.5 ft Sizes: L 6.5 x B 4.5 ft Sizes: L 6.5 x B 4.5 ft ADD TO CART",799.17,3499,80% Off,729.19
Added to Cart | Shortlisted | Already Viewed | 3 Left,Happy Hues Cute,"Pear Night Light Squishy LED Lamp,... Features three warm light modes and an LED motion sensor that switches... (2 Ratings)  ADD TO CART",589.84,1990,70% Off,550.04
Added to Cart | Shortlisted | Already Viewed | 2 Left,FunBlast Glow,"in The Dark Blanket for Boys & Girls -... 3+Years, L 152 x B 127 cm, Glow in the dark blankets is made of 280 GSM... (23 Ratings)  ADD TO CART",1183.81,1999,41% Off,1143.83
Added to Cart | Shortlisted | Already Viewed,Coupon Inside Intelliskills,"Premium Extra Large Reversible Alphabet... Ideal Age 0 to 4 Years, The double-sided mat has information on both sides... (6288 Ratings)  Sizes: L 6.5 x B 4.5 ft Sizes: L 6.5 x B 4.5 ft Sizes: L 6.5 x B 4.5 ft Sizes: L 6.5 x B 4.5 ft Sizes: L 6.5 x B 4.5 ft Sizes: L 6.5 x B 4.5 ft Sizes: L 6.5 x B 4.5 ft ADD TO CART",699.8,3499,80% Off,629.82
Added to Cart | Shortlisted | Already Viewed | 3 Left,Bestseller Premium DDecor,"Blue Orange Cartoon Characters Cotton 144 TC... L 274 cm x B 254 cm, WT 1500 g, 144 TC Queen Bedsheet With 2 Pillow Covers...  Sizes: L 274 x B 254 cm Sizes: L 274 x B 254 cm Sizes: L 274 x B 254 cm Sizes: L 274 x B 254 cm Sizes: L 274 x B 254 cm Sizes: L 274 x B 254 cm Sizes: L 274 x B 254 cm Sizes: L 274 x B 254 cm ADD TO CART",2076.84,2899,30% Off,2018.86
Added to Cart | Shortlisted | Already Viewed | 2 Left,New Fiddlerz Telephone,"Flower Table Lamp for Kids... cartoon lamp with flower-shaped soft light, character figurine, dial base,...  ADD TO CART",468.4,699,33% Off,447.43
Added to Cart | Shortlisted | Already Viewed,Today's Deal AKN,"TOYS Star Master Rotating 360 Degree Moon Night... 3 Years+, Fill your room with stars and moonlight, so that you feel as if... (122 Ratings)  ADD TO CART",273.55,499,45% Off,258.58
Added to Cart | Shortlisted | Already Viewed,Bestseller Babyhug Premium,"Reversible Foldable Waterproof Floor... Ideal Age 0 to 4 Years, Educational mat with stimulating and vibrant... (1849 Ratings)  Sizes: L 180 x B 120 cm Sizes: L 180 x B 150 cm ADD TO CART",819.59,1999,59% Off,779.61
Added to Cart | Shortlisted | Already Viewed,Today's Deal NEGOCIO,"Projector Night Light, Astronaut Projector... The planetarium projector appearance design is novel and unique, the... (19 Ratings)  ADD TO CART",734.51,1499,51% Off,704.53
Added to Cart | Shortlisted | Already Viewed,Bestseller Coupon Inside,"Babyhug Kid's Small 1 Day Trip Trolley Bag Unicorn... 3 Years+, 31 x 20 x 45 cm, Ideal for a small 1 day trip, A durable trolley... (1094 Ratings)  Sizes: L 31 x H 45 cm Sizes: L 31 x H 45 cm Sizes: L 31 x H 45 cm Sizes: L 31 x H 45 cm Sizes: L 31 x H 45 cm Sizes: L 31 x H 45 cm Sizes: L 31 x H 45 cm Sizes: L 31 x H 45 cm ADD TO CART",2389.4,4595,55% Off,2297.5
Added to Cart | Shortlisted | Already Viewed | 1 Left,Babyhug Disney Mickey,"Mouse Hard Sided Kids Trolley... 0 to 15 Years, L 31 x B 21 x H 86 cm A perfect blend of style and utility,... (43 Ratings)  Sizes: L 31 x B 21 x H 86 cm Sizes: L 31 x B 21 x H 86 cm ADD TO CART",4649.07,4999,7% Off,4549.09
Added to Cart | Shortlisted | Already Viewed,Premium Mokobara The,"Moko Blocks Hard Kids Trolley - Cotton... 3-8 years, 31cm x 23cm x 38cm, The Mokobara Moko Blocks hard kids...  Sizes: L 31 x B 23 x H 38 cm Sizes: L 31 x B 23 x H 38 cm Sizes: L 31 x B 23 x H 38 cm Sizes: L 31 x B 23 x H 38 cm ADD TO CART",4999.5,9999,50% Off,4999.5
Added to Cart | Shortlisted | Already Viewed,Bestseller Pine Kids,"Trolley Luggage Bags Pink - 23 inch 5 to 15 Years,L 38 x B 24 x H 58 cm, A perfect blend of style and utility,... (159 Ratings)  ADD TO CART",3242.25,5895,45% Off,3124.35
Added to Cart | Shortlisted | Already Viewed,Babyhug Multifunctional Portable,"Travel Toiletry Bag... L 25 x B 18.5 x H 10.5 cm , Ideal for organizing toiletries, skincare... (18 Ratings)  Sizes: L 25 x B 18.5 x H 10.5 cm Sizes: L 25 x B 18.5 x H 10.5 cm Sizes: L 25 x B 18.5 x H 10.5 cm Sizes: L 25 x B 18.5 x H 10.5 cm ADD TO CART",257.05,485,47% Off,257.05
Added to Cart | Shortlisted | Already Viewed,Navrangi Cute Sea,"Shell design pearl print Trolley Bag... Size: 16"" Cabin Size,cute shell designMain material of the shell:... (1 Rating)  ADD TO CART",2875.2,5995,52% Off,2875.2
Added to Cart | Shortlisted | Already Viewed,Bestseller Kid's Travel,"Suitcase Trolley Bag with Wheels - 18... 3 to 6 Years, L 31 x B 22 x H 45 cm, lightweight luggage trolley and... (423 Ratings)  Sizes: L 31 x B 22 x H 45 cm Sizes: L 31 x B 22 x H 45 cm Sizes: L 31 x B 22 x H 45 cm Sizes: L 31 x B 22 x H 45 cm ADD TO CART",2997.5,5995,55% Off,2877.6
Added to Cart | Shortlisted | Already Viewed,Babyhug Multifunctional Portable,"Travel Toiletry Bag... L 25 x B 18.5 x H 10.5 cm , Ideal for organizing toiletries, skincare... (18 Ratings)  Sizes: L 25 x B 18.5 x H 10.5 cm Sizes: L 25 x B 18.5 x H 10.5 cm Sizes: L 25 x B 18.5 x H 10.5 cm Sizes: L 25 x B 18.5 x H 10.5 cm ADD TO CART",257.05,485,47% Off,257.05
Added to Cart | Shortlisted | Already Viewed,Babyhug Trolley Bag,"Space Theme Print Purple-16 Inches L 32 x B 25 x H 90 cm, Ideal for a small 1 day trip, A durable trolley bag...  ADD TO CART",2197.25,3995,45% Off,2117.35
Added to Cart | Shortlisted | Already Viewed,Kid's Travel Suitcase,"Trolley Bag with Wheels - 18... 3 to 6 Years, L 31 x B 22 x H 45 cm, lightweight luggage trolley and... (423 Ratings)  Sizes: L 31 x B 22 x H 45 cm Sizes: L 31 x B 22 x H 45 cm Sizes: L 31 x B 22 x H 45 cm Sizes: L 31 x B 22 x H 45 cm ADD TO CART",2997.5,5995,55% Off,2877.6
Added to Cart | Shortlisted | Already Viewed | 1 Left,D Paradise Luggage,"Trolley Bag Peppa Pig Print Green... 0 to 10 Years, L 32 x B 20 x H 40 cm, A perfect blend of style and... (4 Ratings)  ADD TO CART",2048.9,4299,52% Off,2048.9
Added to Cart | Shortlisted | Already Viewed,Coupon Inside Babyhug,"Kid's Small 1 Day Trip Trolley Bag Animal... 3 Years+, 31 x 20 x 45 cm, Ideal for a small 1 day trip, A durable trolley... (1094 Ratings)  Sizes: L 31 x H 45 cm Sizes: L 31 x H 45 cm Sizes: L 31 x H 45 cm Sizes: L 31 x H 45 cm Sizes: L 31 x H 45 cm Sizes: L 31 x H 45 cm Sizes: L 31 x H 45 cm Sizes: L 31 x H 45 cm ADD TO CART",2389.4,4595,55% Off,2297.5
Added to Cart | Shortlisted | Already Viewed,Bestseller SCHOOLISH Dust-Proof,"Cute 3D Cartoon Kids Stylish mini... 3 Yrs+, These bag is Soft and lightweight EVA, wear-resistant,... (1 Rating)  ADD TO CART",624.93,1499,58% Off,594.95
Added to Cart | Shortlisted | Already Viewed,Babyhug Kid's Small,"1 Day Trip Trolley Bag Puppy Print... 3 Years+, 31 x 20 x 45 cm, Ideal for a small 1 day trip, A durable trolley... (1094 Ratings)  Sizes: L 31 x H 45 cm Sizes: L 31 x H 45 cm Sizes: L 31 x H 45 cm Sizes: L 31 x H 45 cm Sizes: L 31 x H 45 cm Sizes: L 31 x H 45 cm Sizes: L 31 x H 45 cm Sizes: L 31 x H 45 cm ADD TO CART",2067.75,4595,55% Off,1975.85
Added to Cart | Shortlisted | Already Viewed,Navrangi Kid's Travel,"Suitcase Car-Shaped Trolley Bag... 3 to 10 Years, L 32 x B 22 x H 43 cm, lightweight luggage trolley and... (2 Ratings)  ADD TO CART",3295.34,6995,53% Off,3295.34
Added to Cart | Shortlisted | Already Viewed,Babyhug Multifunctional Portable,"Travel Toiletry Bag... L 25 x B 18.5 x H 10.5 cm , Ideal for organizing toiletries, skincare... (18 Ratings)  Sizes: L 25 x B 18.5 x H 10.5 cm Sizes: L 25 x B 18.5 x H 10.5 cm Sizes: L 25 x B 18.5 x H 10.5 cm Sizes: L 25 x B 18.5 x H 10.5 cm ADD TO CART",257.05,485,47% Off,257.05
Added to Cart | Shortlisted | Already Viewed,Kids Travel Luggage,With Carry-On Luggage & Wheels... Kids Travel Luggage With Exciting Print! (12 Ratings)  Sizes: L 39.5 x B x 22 x H 86 cm Sizes: L 39.5 x B x 22 x H 86 cm Sizes: L 39.5 x B x 22 x H 86 cm ADD TO CART,2448.15,4295,43% Off,2362.25
Added to Cart | Shortlisted | Already Viewed,Coupon Inside Intellibaby,"Premium Magnetic Giraffe Height Growth... Ideal age 0 to 24 Months, L 30 x B 21.5 x H 9 cm, Helps in measuring... (88 Ratings)  ADD TO CART",448.96,800,44% Off,432.96
Added to Cart | Shortlisted | Already Viewed,Jaamso Royals Inspirational,"Quotes Girl Design Wall... L 30 x B 80 x H 0.1 cm, No transfer film needed, simply peel and stick.  ADD TO CART",461.27,1299,64% Off,435.29
Added to Cart | Shortlisted | Already Viewed,Wallstick Music Birds,"Wallsticker L 120 x B 70 x H 0.1 cm, Our stickers are easy to stick and easy to remove...  ADD TO CART",287.68,899,68% Off,269.7
Added to Cart | Shortlisted | Already Viewed | 3 Left,FunBlast Cute Kawaii,"Puffy Stickers Set Pack of 3... 3+ Years, 3D Self Adhesive Puffy Stickers - These stickers come in...  ADD TO CART",307.35,699,56% Off,293.37
Added to Cart | Shortlisted | Already Viewed,Bunie Animal,"mal Theme Puffy Stickers Set Pack of 2... 3+ Years, 3D Self Adhesive Puffy Stickers - These stickers come in... (1 Rating)  ADD TO CART",160.53,499,68% Off,150.55
Added to Cart | Shortlisted | Already Viewed,RoomMates Peel And,"Stick Wall Decals - Jelly Bug 26 x 12.5 x 2.5 cm, Decorate your babies room with this wall decals  ADD TO CART",879.95,1199,27% Off,855.97
Added to Cart | Shortlisted | Already Viewed,Jaamso Royals Cute,"Cloud and Rainbow Peel and Stick... L 60 x B 30 x H 0.1 cm, No transfer film needed, simply peel and stick. (1 Rating)  ADD TO CART",226.2,499,55% Off,216.22
Added to Cart | Shortlisted | Already Viewed,Jaamso Royals New,"Design Colorful Rainbow Stickers... L 60 x B 30 x H 0.1 cm, No transfer film needed, simply peel and stick. (2 Ratings)  ADD TO CART",226.2,499,55% Off,216.22
Added to Cart | Shortlisted | Already Viewed,Premium Aroha House,Roaring Adventures Peel and Stick Home... Aroha House Roaring Adventures Peel and Stick Home Decor Wall-Paper. L:...  ADD TO CART,2222.85,2555,13% Off,2171.75
Added to Cart | Shortlisted | Already Viewed,Jaamso Royals Tree,"With Animals Design Kids Room Decor... L 30 x B 90 x H 0.1 cm, No transfer film needed, simply peel and stick. (1 Rating)  ADD TO CART",229.39,799,71% Off,213.41
Added to Cart | Shortlisted | Already Viewed,Jaamso Royals Cartoon,"Bear and Baby Elephant Design... L 60 x B 90 x H 0.1 cm, No transfer film needed, simply peel and stick. (3 Ratings)  ADD TO CART",229.39,799,71% Off,213.41
Added to Cart | Shortlisted | Already Viewed,Premium Aroha House,Mosaic Magic Peel and Stick Home Decor... Aroha House Mosaic Magic Peel and Stick Home Decor Wall-Paper. L: 304.8cm...  ADD TO CART,2222.85,2555,13% Off,2171.75
Added to Cart | Shortlisted | Already Viewed,Jaamso Royals,"' Winnie The Pooh Home Decor Cartoon... L 50 x B 70 x H 0.1 cm, No transfer film needed, simply peel and stick.  ADD TO CART",229.39,799,71% Off,213.41
Added to Cart | Shortlisted | Already Viewed,Jaamso Royals Animals,"Jungle Design Wall Sticker for... L 30 x B 90 x H 0.1 cm, No transfer film needed, simply peel and stick.  ADD TO CART",301.9,999,70% Off,281.92
Added to Cart | Shortlisted | Already Viewed,Premium Aroha House,Jungle Dream Peel and Stick Home-Dcor... Aroha House Jungle Dream Peel and Stick Home Decor Wall-Paper. L: 304.8cm...  ADD TO CART,2222.85,2555,13% Off,2171.75
Added to Cart | Shortlisted | Already Viewed,Bestseller Babyhug Unicorn,"Wall Clock - White L 28 x B 28 x H 6 cm, Durable and attractively designed clock for your... (47 Ratings)  ADD TO CART",491.15,1045,53% Off,470.25
Added to Cart | Shortlisted | Already Viewed,Asera Unicorn Table,"Alarm Clock With Pen Stand - Blue 3 to 15 Years, L 16 x B 15 x H 5 cm, The clock also has alarm... (15 Ratings)  ADD TO CART",342.99,599,43% Off,331.01
Added to Cart | Shortlisted | Already Viewed,Car Design Pendulum,"Clock - Yellow 3 to 12 Years, L 6.5 x B 14 x H 24.5 cm, Attractive car design pendulum... (2 Ratings)  ADD TO CART",339.15,595,43% Off,327.25
Added to Cart | Shortlisted | Already Viewed | 1 Left,Pine Kids Yes,"I Can Wall Clock - White L 30 x B 30 x H 5 cm, Durable and attractively designed clock for your... (147 Ratings)  Sizes: L 30 x B 30 x H 5 cm Sizes: L 30 x B 30 x H 5 cm Sizes: L 30 x B 30 x H 5 cm Sizes: L 30 x B 30 x H 5 cm Sizes: L 30 x B 30 x H 5 cm ADD TO CART",491.15,1045,53% Off,470.25
Added to Cart | Shortlisted | Already Viewed,Bestseller Kidoz Battery,"Operated Silent Movement Princess Crown... 3 to 12 Years, L 19.5 x B 14.5 x H 1 cm, Durable battery operated clock  ADD TO CART",1635.18,1999,18% Off,1635.18
Added to Cart | Shortlisted | Already Viewed,Asera Plastic Alarm,"Clock - Yellow 3 to 15 Years, L 18 x B 14 x H 4.5 cm, The clock also has alarm... (11 Ratings)  ADD TO CART",374.05,499,25% Off,364.07
Added to Cart | Shortlisted | Already Viewed,AKN TOYS Bedside,"Alarm Clock for Kids Room Decor and... 3 to 10 Years, L 10 x B 6 x H 13 cm, the clock also has alarm... (7 Ratings)  ADD TO CART",412.83,729,43% Off,398.25
Added to Cart | Shortlisted | Already Viewed | 1 Left,Bestseller Bunie Motorcycle,"Design Alarm Clock Red 3+Years, L 10.5 x B 18.5 x H 3.5 cm, Stylish analog desk alarm clock for... (19 Ratings)  Sizes: L 10.5 x B 18.5 x H 3.5 cm Sizes: L 10.5 x B 18.5 x H 3.5 cm Sizes: L 10.5 x B 18.5 x H 3.5 cm Sizes: L 10.5 x B 18.5 x H 3.5 cm ADD TO CART",385.31,999,67% Off,365.33
Added to Cart | Shortlisted | Already Viewed,The Procure Store,"Cute Alarm Clock with Unicorn Motif-... 3 Years+, L 8.5 x B 5.5 x H 15 cm, Convenient to be taken along while... (2 Ratings)  ADD TO CART",503.69,799,37% Off,487.71
Added to Cart | Shortlisted | Already Viewed,KIDOZ Space Shaped,Clock BLUE New born-15yrs L 40.6cm x B 30.5cm fun and colorful children's clock...  ADD TO CART,869.36,1899,54% Off,869.36
Added to Cart | Shortlisted | Already Viewed,NEGOCIO Dino Shaped,"Table Alarm Clock - Multicolor 3 to 15 Years, L 16 x B 13 x H 17 cm, Twin bell alarm with LED Night... (7 Ratings)  ADD TO CART",551.82,1299,58% Off,525.84
Added to Cart | Shortlisted | Already Viewed,Sanjary Unicorn Alarm,"Clock - (Color May Vary) 3 to 10 Years, L 14 x B 10.5 x H 5.5 cm, the clock also has alarm... (8 Ratings)  ADD TO CART",441.66,1299,66% Off,415.68
Added to Cart | Shortlisted | Already Viewed | 3 Left,The Procure Store,"Astronaut Design Alarm Clock- Grey 3 Years+, L 13 x B 6 x H 17.5 cm, Convenient to be taken along while...  ADD TO CART",507.29,999,49% Off,487.31
Added to Cart | Shortlisted | Already Viewed,Sanjary Dinosuar Multifunction,"Alarm Clock - Green 3 to 15 Years, L 17 x B 9.5 x H 18.1 cm, Twin bell alarm with LED Night... (3 Ratings)  ADD TO CART",543.99,1499,64% Off,514.01
Added to Cart | Shortlisted | Already Viewed,KIDOZ Choo Choo,Train Clock Dark Blue New born-15yrs L 20.32 x B 20.38 blue background with white easy-to-read... (2 Ratings)  ADD TO CART,538.21,799,33% Off,538.21
Added to Cart | Shortlisted | Already Viewed,Olive Wooden,"ooden Designer Tic-Toc Movement Wall Clock... Olive Tree Plastic Wall Clock 12"" Analog Decorative Latest Modern Wall... (3 Ratings)  Sizes: L 20 x B 3.81 x H 60 cm Sizes: L 29 x B 24 cm Sizes: L 29 x B 29 cm ADD TO CART",424.32,1248,66% Off,399.36
Added to Cart | Shortlisted | Already Viewed | 2 Left,Pine Kids Solar,"Wall Clock - Blue & Black L 30 x B 30 x H 5 cm, Durable and attractively designed clock for your... (147 Ratings)  Sizes: L 30 x B 30 x H 5 cm Sizes: L 30 x B 30 x H 5 cm Sizes: L 30 x B 30 x H 5 cm Sizes: L 30 x B 30 x H 5 cm Sizes: L 30 x B 30 x H 5 cm ADD TO CART",522.5,1045,53% Off,501.6
Added to Cart | Shortlisted | Already Viewed | 2 Left,FunBlast Twin Bell,"Alarm Clock with Pen Holder -... 3 to 10 Years, L 14.5 x B 5 x H 14.5 cm, The clock also has alarm... (2 Ratings)  ADD TO CART",285.28,499,43% Off,275.3
Added to Cart | Shortlisted | Already Viewed,Kidoz Battery Operated,"Silent Movement Animal Premium... 3 to 12 Years, L 12 x B 12 x H 1 cm, Durable battery operated clock (1 Rating)  ADD TO CART",916.55,1599,43% Off,916.55
Added to Cart | Shortlisted | Already Viewed,Bestseller Mom's Pick,"Babyhug Liquid Laundry Detergent Refill Pack - 1500 ml Anti-bacterial, tough on stains, gentle on fabric (9711 Ratings)  (265.83 Per l) ADD TO CART",398.75,725,45% Off,384.25
Added to Cart | Shortlisted | Already Viewed,Bestseller Mother Sparsh,"Baby Plant Powered Baby Laundry Liquid... 0 Months+, Our laundry detergent for babies is made with organic herbs,... (200 Ratings)  ADD TO CART",889.7,2170,59% Off,846.3
Added to Cart | Shortlisted | Already Viewed,Bestseller Mom's Pick,"Babyhug Feeding Bottles, Accessories & Vegetables... Anti-bacterial, cleans wide range of baby's accessories thoroughly (31.4k Ratings)  ADD TO CART",217.25,395,45% Off,209.35
Added to Cart | Shortlisted | Already Viewed,Pigeon Liquid Cleanser,Refill - 500 ml Removes even the toughest formula stains but remains gentle on the skin (349 Ratings)  (0.57 Per ml) ADD TO CART,284.25,379,25% Off,276.67
