Status,Brand,Title,Discounted Price,Original Price,Discount Percent,Club Price
Added to Cart | Shortlisted | Already Viewed,Today's Deal Baybee,"2 in 1 Foldable Kids Playpen with Basketball... 132 x 132 x 70 cm features a basketball set, sensory toys, and double knob... (2 Ratings)  Sizes: L 132 x B 132 x H 70 cm Sizes: L 132 x B 132 x H 70 cm ADD TO CART",12202.44,15999,28% Off,12202.44
Added to Cart | Shortlisted | Already Viewed,Today's Deal Baybee,"2 in 1 Foldable Kids Playpen with Basketball... 132 x 132 x 70 cm features a basketball set, sensory toys, and double knob... (2 Ratings)  Sizes: L 132 x B 132 x H 70 cm Sizes: L 132 x B 132 x H 70 cm ADD TO CART",13760.98,18999,28% Off,13760.98
Added to Cart | Shortlisted | Already Viewed,Bestseller Smart Portable,"with Safety Lock Playpen with Play Gate... 0 Months+ ,L 192.5 x B 163 x H 61 cm , This playpen is spacious enough for... (67 Ratings)  Sizes: L 192.5 x B 163 x H 61 cm Sizes: L 192.5 x B 163 x H 61 cm,L 192.5 x B 163 x H 61 cm Sizes: L 192.5 x B 163 x H 61 cm ADD TO CART",2472.25,4495,45% Off,2382.35
Added to Cart | Shortlisted | Already Viewed,Mastela Swing H,"Multi-Motion BabyCradel Grey Birth to... 0 to 36 Months, L 78 x B 45.5 x H 80 cm,carrying capacity 15 kg, Playing...  ADD TO CART",16529.13,18999,13% Off,16149.15
Added to Cart | Shortlisted | Already Viewed,Today's Deal MeeMee,"Sweet Love Automatic Electric Baby Cradle |... 0 Months To 18 Months,Length 98.2cm, Breadth 55cm, Height 88.7cm, Carrying...  ADD TO CART",9569.13,10999,13% Off,9349.15
Added to Cart | Shortlisted | Already Viewed,Today's Deal Furnifest,"Wooden Cot Crib with Mattress and Mosquito... The FURNIFEST Baby Cot Crib is crafted from durable German pinewood,... (22 Ratings)  ADD TO CART",7338.8,14000,48% Off,7338.8
Added to Cart | Shortlisted | Already Viewed,Bestseller Save W/,"Coupon Babyhug Premium Bedding Super Saver Combo Set of 3... 0 to 6 Months, L 90 x B 60 x H 46 cm, combo gadda set in attractive print... (630 Ratings)  Sizes: L 90 x B 60 x H 46 cm Sizes: L 90 x B 60 x H 46 cm Sizes: L 90 x B 60 x H 46 cm ADD TO CART",2479.38,3999,43% Off,2399.4
Added to Cart | Shortlisted | Already Viewed,Bestseller Moms Home,"Baby Super Soft Absorbent Muslin 6 Layer... 0 to 12 Months, L 100 x B 100 x H 2 cm, Super soft and durable,... (592 Ratings)  Sizes: L 100 x B 100 x H 2 cm Sizes: L 100 x B 100 x H 2 cm ADD TO CART",664.47,1999,67% Off,664.47
Added to Cart | Shortlisted | Already Viewed,Bestseller Save W/,"Coupon Babyhug 100% Cotton Hooded Wrapper Sports Print - Blue 0 to 6 Months, L 80 x B 80 cm,This wrapping towel offers maximum comfort... (3621 Ratings)  Sizes: 0-6m Sizes: 0-6m Sizes: 0-6m Sizes: 0-6m ADD TO CART",320.4,445,32% Off,311.5
Added to Cart | Shortlisted | Already Viewed,Today's Deal Trance,"Home Linen Super Soft Cotton Malmal Swaddle... 0 to 12 Months, L 100 x B 100 cm, Safe and Gentle material for kid's... (1532 Ratings)  Sizes: Animal Print Sizes: Animal Print Sizes: Boat Print Sizes: Boat Print Sizes: Checkered Sizes: Checkered Sizes: Elephant Print +11 ADD TO CART",595.8,999,46% Off,595.8
Added to Cart | Shortlisted | Already Viewed,New Babyhug Bubble,"Embroidered Hooded Wrapper Lion Patch -... 0 to 9 Months, ,This wrapping towel offers maximum comfort and durability (2 Ratings)  Sizes: L 76 x B 76 cm Sizes: L 76 x B 76 cm ADD TO CART",468.33,699,33% Off,454.35
Added to Cart | Shortlisted | Already Viewed,Today's Deal Brandonn,"Hooded Supersoft Wearable Wrapper Blanket -... 0 to 6 Months, L 76 x B 70 cm, gentle & lightweight baby blanket (673 Ratings)  Sizes: L 70 x B 70 cm Sizes: L 76 x B 70 cm Sizes: L 76 x B 70 cm Sizes: L 76 x B 70 cm Sizes: L 76 x B 70 cm Sizes: L 76 x B 70 cm Sizes: L 76 x B 70 cm ADD TO CART",273.53,999,73% Off,273.53
Added to Cart | Shortlisted | Already Viewed,Bestseller Babyhug Premium,"Bedding Super Save Combo Set of 3 Duck... 0 to 6 Months, L 90 x B 60 x H 46 cm, combo gadda set in attractive print... (630 Ratings)  Sizes: L 90 x B 60 x H 46 cm Sizes: L 90 x B 60 x H 46 cm Sizes: L 90 x B 60 x H 46 cm ADD TO CART",2279.43,3999,43% Off,2199.45
Added to Cart | Shortlisted | Already Viewed,Bestseller Babyhug Cotton,"Muslin Multipurpose Swaddle Wraps... 0 to 12 Months, L 100 x B 100 cm, lightweight & breathable multipurpose... (191 Ratings)  Sizes: L 100 x B 100 cm Sizes: L 100 x B 100 cm ADD TO CART",989.4,1649,40% Off,956.42
Added to Cart | Shortlisted | Already Viewed,Moms Home Organic,"Cotton Baby Muslin AC Quilt Blanket... 0 to 12 Months, L 112 x B 112 cm, Super soft and Breathable to keep baby... (401 Ratings)  Sizes: L 100 x B 120 cm Sizes: L 110 x B 120 cm Sizes: L 110 x B 120 cm Sizes: L 112 x B 112 cm Sizes: L 112 x B 112 cm Sizes: L 112 x B 112 cm Sizes: L 112 x B 112 cm +7 ADD TO CART",609.34,2199,72% Off,609.34
Added to Cart | Shortlisted | Already Viewed,Bestseller Babyhug Premium,"Bedding Super Saver Combo Jungle Print... 0 to 6 Months,L 90 x B 60 cm, combo gadda set for your baby's comfortable... (417 Ratings)  Sizes: L 63 X B 19 X H 50.5 cm Sizes: L 63 X B 19 X H 50.5 cm Sizes: L 63 X B 19 X H 50.5 cm ADD TO CART",2357.05,3995,44% Off,2277.15
Added to Cart | Shortlisted | Already Viewed,Bestseller Babyhug Bubble,"Giraffe Embroidered 3 in 1 Baby Carry... 0 to 4 Months,L 70 x B 30 cm, Made with soft Velvet fabric which ensures... (1209 Ratings)  Sizes: L 70 x B 30 cm Sizes: L 70 x B 30 cm Sizes: L 70 x B 30 cm ADD TO CART",719.28,999,32% Off,699.3
Added to Cart | Shortlisted | Already Viewed,VParents Galaxy Baby,"Bedding Set with Pillow and... 0 to 6 Months, L 85 x B 42 x H 40 cm, easily foldable, light weight making... (188 Ratings)  Sizes: L 85 x B 42 x H 40 cm Sizes: L 85 x B 42 x H 40 cm ADD TO CART",790.27,1499,47% Off,790.27
Added to Cart | Shortlisted | Already Viewed,Bestseller Babyhug Cotton,"Muslin Multipurpose Swaddle Wraps... 0 to 12 Months, L 100 x B 100 cm, lightweight & breathable multipurpose... (408 Ratings)  Sizes: L 100 x B 100 cm Sizes: L 100 x B 100 cm Sizes: L 100 x B 100 cm Sizes: L 100 x B 100 cm ADD TO CART",608.42,1049,43% Off,587.44
Added to Cart | Shortlisted | Already Viewed,Premium Mi Arcus,"Premium Knitted 100% Cotton Lightweight Cool... 0 to 12 Months, L 70 x B 90 cm, soft and comfortable blanket with high... (218 Ratings)  ADD TO CART",1014.59,1199,15% Off,1014.59
Added to Cart | Shortlisted | Already Viewed,Babyhug Premium Bedding,"Super Saver Combo Set of 3... 0 to 6 Months, L 90 x B 60 x H 46 cm, combo gadda set in attractive print... (630 Ratings)  Sizes: L 90 x B 60 x H 46 cm Sizes: L 90 x B 60 x H 46 cm Sizes: L 90 x B 60 x H 46 cm ADD TO CART",3719.07,3999,43% Off,3639.09
Added to Cart | Shortlisted | Already Viewed,Moms Home Baby,"Super Soft Absorbent Muslin 6 Layer... 0 Months to 3 Years, L 112 x B 112 cm, Super soft and Breathable to keep... (401 Ratings)  Sizes: L 100 x B 120 cm Sizes: L 110 x B 120 cm Sizes: L 110 x B 120 cm Sizes: L 112 x B 112 cm Sizes: L 112 x B 112 cm Sizes: L 112 x B 112 cm Sizes: L 112 x B 112 cm +7 ADD TO CART",609.34,2199,72% Off,609.34
Added to Cart | Shortlisted | Already Viewed,Babyhug Cotton Muslin,"Multipurpose Swaddle Wraps Pack... 0 to 12 Months, L 100 x B 100 cm, lightweight & breathable multipurpose... (408 Ratings)  Sizes: L 100 x B 100 cm Sizes: L 100 x B 100 cm Sizes: L 100 x B 100 cm Sizes: L 100 x B 100 cm ADD TO CART",597.93,1049,43% Off,576.95
Added to Cart | Shortlisted | Already Viewed,Today's Deal Elementary,"Organic Cotton Muslin Swaddle Wrapper... 0 to 24 Months, L 112 x B 0.5 x H 112 cm, a multipurpose blanket that is... (2952 Ratings)  Sizes: L 112 x B 0.5 x H 112 cm Sizes: L 112 x B 0.5 x H 112 cm Sizes: L 112 x B 0.5 x H 112 cm Sizes: L 112 x B 0.5 x H 112 cm Sizes: L 112 x B 0.5 x H 112 cm Sizes: L 112 x B 112 cm ADD TO CART",642.05,1899,66% Off,604.07
Added to Cart | Shortlisted | Already Viewed,Babyhug Premium Cotton,"Snug Pod Baby Wrap Teddy Print-... 0 to 6 Months, L 85 x B 80 cm Extra soft fabric for the newborn babies (147 Ratings)  Sizes: L 45.7 x B 58.4 cm Sizes: L 85 x B 80 cm ADD TO CART",539.4,899,40% Off,521.42
Added to Cart | Shortlisted | Already Viewed,Moms Home Organic,"Cotton Baby Muslin AC Quilt Blanket... 0 to 3 Years, L 112 x B 112 cm, Super soft and Breathable to keep baby at... (401 Ratings)  Sizes: L 100 x B 120 cm Sizes: L 110 x B 120 cm Sizes: L 110 x B 120 cm Sizes: L 112 x B 112 cm Sizes: L 112 x B 112 cm Sizes: L 112 x B 112 cm Sizes: L 112 x B 112 cm +7 ADD TO CART",730.95,2199,72% Off,730.95
Added to Cart | Shortlisted | Already Viewed,Bestseller Babyhug Cotton,"Head Shaping 1 Kg Mustard Seeds/Rai... 0 to 24 Months, L 24 x B 31 x H 2.5 cm, Pillow allows air circulation and... (2521 Ratings)  Sizes: L 24 x 31 x B 2.5 cm Sizes: L 24 x B 31 x H 2.5 cm Sizes: L 24 x B 31 x H 2.5 cm ADD TO CART",428.4,595,29% Off,416.5
Added to Cart | Shortlisted | Already Viewed,Bestseller Save W/,"Coupon Babyhug Premium Bedding Super Saver Combo Set of 3... 0 to 6 Months, L 90 x B 60 x H 46 cm, combo gadda set in attractive print... (630 Ratings)  Sizes: L 90 x B 60 x H 46 cm Sizes: L 90 x B 60 x H 46 cm Sizes: L 90 x B 60 x H 46 cm ADD TO CART",2479.38,3999,43% Off,2399.4
Added to Cart | Shortlisted | Already Viewed,Bestseller Premium Abracadabra,"Woodland Friends Baby Bedding Set of 6... 0 to 24 Months, Package Dimension - L 41 x B 31 x H 45 cm, Made with... (41 Ratings)  ADD TO CART",6399.2,7999,20% Off,6239.22
Added to Cart | Shortlisted | Already Viewed,Bestseller Babyhug Cotton,"Bedding Set Elephant Print - Beige 0 to 12 Months, L 90 x B 55 cm, Style up your nursery with this incredible... (226 Ratings)  Sizes: L 90 x B 55 cm Sizes: L 90 x B 55 cm Sizes: L 90 x B 55 cm Sizes: L 90 x B 55 cm Sizes: L 90 x B 60 cm ADD TO CART",863.28,1199,35% Off,839.3
Added to Cart | Shortlisted | Already Viewed,Today's Deal Elementary,"Premium Memory Foam Head Shaping Pillow... 0 to 24 Months, L 26 x B 20 x H 3 cm, Designed to provide proper support... (23 Ratings)  ADD TO CART",636.12,1299,51% Off,610.14
Added to Cart | Shortlisted | Already Viewed,Bestseller Premium Abracadabra,"Cotton Bedding Set Bambi & Friends Theme -... 0 to 12 Months, Mattress Dimensions L 88 x B 60 x H 7 cm, designed to be... (534 Ratings)  Sizes: 88 x 60 x 10 cm Sizes: 88 x 60 x 10 cm Sizes: 88 x 60 x 10 cm Sizes: 88 x 60 x 10 cm Sizes: 88 x 60 x 7 cm Sizes: L 88 x B 60 x H 7 cm Sizes: L 88 x B 60 x H 7 cm +3 ADD TO CART",1599.2,1999,20% Off,1559.22
Added to Cart | Shortlisted | Already Viewed | 1 Left,Bestseller Premium Babyhug,"100% Cotton Digital Printed Crib Bedding Set... 0 to 24 Months, Bumper Dimension L 360 x B 25 cm, Perfect bed set for... (81 Ratings)  Sizes: L 360 x B 25 cm Sizes: L 360 x B 25 cm Sizes: L 360 x B 25 cm Sizes: L 360 x B 25 cm Sizes: L 360 x B 25 cm ADD TO CART",3464.37,5499,37% Off,3354.39
Added to Cart | Shortlisted | Already Viewed,Bestseller Babyhug Premium,"Bedding Super Save Combo Set of 3 Duck... 0 to 6 Months, L 90 x B 60 x H 46 cm, combo gadda set in attractive print... (630 Ratings)  Sizes: L 90 x B 60 x H 46 cm Sizes: L 90 x B 60 x H 46 cm Sizes: L 90 x B 60 x H 46 cm ADD TO CART",2279.43,3999,43% Off,2199.45
Added to Cart | Shortlisted | Already Viewed,Bestseller Coupon Inside,"Babyhug Premium Cotton Bedding Set Jungle Theme Pack... 0 to 12 Months, Mattress Dimensions 88 x 60 cm, comes along with bag, cute... (1219 Ratings)  Sizes: 88 X 60 cm Sizes: 88 X 60 cm Sizes: 88 X 60 cm Sizes: 88 x 60 cm ADD TO CART",1436.4,1995,28% Off,1396.5
Added to Cart | Shortlisted | Already Viewed,Today's Deal Elementary,"Premium Memory Foam Head Shaping Pillow... 0 to 24 Months, L 26 x B 20 x H 3 cm, Designed to provide proper support... (929 Ratings)  ADD TO CART",630.07,999,37% Off,610.09
Added to Cart | Shortlisted | Already Viewed,Bestseller Babyhug Premium,"Bedding Super Saver Combo Jungle Print... 0 to 6 Months,L 90 x B 60 cm, combo gadda set for your baby's comfortable... (417 Ratings)  Sizes: L 63 X B 19 X H 50.5 cm Sizes: L 63 X B 19 X H 50.5 cm Sizes: L 63 X B 19 X H 50.5 cm ADD TO CART",2357.05,3995,44% Off,2277.15
Added to Cart | Shortlisted | Already Viewed,haus,"& kinder Baby Sleeping Pod Portable Adjustable... 0 to 24 Months, L 90 x B 60 cm, Skin-friendly cotton poplin outer layer... (36 Ratings)  Sizes: L 90 x B 60 cm Sizes: L 90 x B 60 cm ADD TO CART",1963.51,3999,51% Off,1963.51
Added to Cart | Shortlisted | Already Viewed,Bestseller Premium Bonfino,"Premium 100% Organic Cotton Crib Bumper... 0 to 24 Months, L 360 x B 25 cm, Snug and soft attractively colored crib... (93 Ratings)  Sizes: L 360 x B 25 cm Sizes: L 360 x B 25 cm ADD TO CART",1797.42,3099,42% Off,1735.44
Added to Cart | Shortlisted | Already Viewed,DearJoy Baby Crib,"Bedding Bumper Teddy Print - Pink 0 to 24 Months, L 300 x B 35.5 x H 3 cm, Made of soft comfortable... (178 Ratings)  Sizes: L 300 x B 35.5 x H 3 cm,L 300 x B 35.5 x H 3 cm Sizes: L 300 x B 35.5 x H 3 cm ADD TO CART",540.5,2500,78% Off,540.5
Added to Cart | Shortlisted | Already Viewed,Babyhug Premium Bedding,"Super Saver Combo Set of 3... 0 to 6 Months, L 90 x B 60 x H 46 cm, combo gadda set in attractive print... (630 Ratings)  Sizes: L 90 x B 60 x H 46 cm Sizes: L 90 x B 60 x H 46 cm Sizes: L 90 x B 60 x H 46 cm ADD TO CART",3719.07,3999,43% Off,3639.09
Added to Cart | Shortlisted | Already Viewed,Today's Deal Fareto,"New Born Baby Fullset - Blue 0 to 6 Months, L 55 x B 49 x H 33.7 cm, Set up a secure and sound sleeping... (229 Ratings)  Sizes: L 55 x B 49 x H 33.7 cm Sizes: L 55 x B 49 x H 33.7 cm Sizes: L 55 x B 49 x H 33.7 cm Sizes: L 55 x B 49 x H 33.7 cm ADD TO CART",1421.13,2599,45% Off,1421.13
Added to Cart | Shortlisted | Already Viewed,Premium Abracadabra Cotton,"Bedding Set Sleepy Friends Theme -... 0 to 12 Months, Mattress Dimensions 88 x 60 x 7 cm, designed to be well... (534 Ratings)  Sizes: 88 x 60 x 10 cm Sizes: 88 x 60 x 10 cm Sizes: 88 x 60 x 10 cm Sizes: 88 x 60 x 10 cm Sizes: 88 x 60 x 7 cm Sizes: L 88 x B 60 x H 7 cm Sizes: L 88 x B 60 x H 7 cm +3 ADD TO CART",1859.07,1999,20% Off,1819.09
Added to Cart | Shortlisted | Already Viewed,Bestseller Ortis Baby,Hugging Pillow for Head Shaping - Sky Blue Baby Hugging Pillow for Head Shaping (71 Ratings)  ADD TO CART,249.02,899,72% Off,231.04
Added to Cart | Shortlisted | Already Viewed,Premium Abracadabra Head,"Shaping Mustard Seed Rai Pillow With... 0 to 12 Months, L 30 x B 22 x H 2.5 cm, supports head formation and... (1601 Ratings)  Sizes: L 30 x B 22 x H 2.5 cm,L 30 x B 22 x H 2.5 cm Sizes: L 30 x B 22 x H 2.5 cm,L 30 x B 22 x H 2.5 cm Sizes: L 30 x B 22 x H 2.5 cm,L 30 x B 22 x H 2.5 cm Sizes: L 30 x B 22 x H 2.5 cm,L 30 x B 22 x H 2.5 cm Sizes: L 30 x B 22 x H 2.5 cm,L 30 x B 22 x H 2.5 cm Sizes: L 30 x B 22 x H 2.5 cm,L 30 x B 22 x H 2.5 cm Sizes: L 30 x B 22 x H 2.5 cm Sizes: L 30 x B 22 x H 2.5 cm ADD TO CART",559.2,699,20% Off,545.22
Added to Cart | Shortlisted | Already Viewed,Bestseller Babyhug Cotton,"Bedding Set with Mosquito Net Animal... 0 to 9 months, L 90 x B 60 x H 40 cm, foldable, lightweight, easy to... (389 Ratings)  Sizes: L 90 x B 60 x H 40 cm Sizes: L 90 x B 60 x H 40 cm ADD TO CART",929.38,1499,38% Off,899.4
Added to Cart | Shortlisted | Already Viewed,Bestseller Save W/,"Coupon Babyhug Premium Bedding Super Saver Combo Set of 3... 0 to 6 Months, L 90 x B 60 x H 46 cm, combo gadda set in attractive print... (630 Ratings)  Sizes: L 90 x B 60 x H 46 cm Sizes: L 90 x B 60 x H 46 cm Sizes: L 90 x B 60 x H 46 cm ADD TO CART",2479.38,3999,43% Off,2399.4
Added to Cart | Shortlisted | Already Viewed,Today's Deal LifeKrafts,"Baby Foldable Mosquito Net - Green 0 to 24 Months, L 135 x B 65 x H 65 cm, mesh fabric used in the net... (2683 Ratings)  Sizes: EFB9C4 Sizes: L 110 x B 60 x H 55 cm Sizes: L 135 x B 65 x H 65 cm Sizes: L 135 x B 65 x H 65 cm Sizes: L 135 x B 65 x H 65 cm ADD TO CART",876.96,1050,16% Off,855.96
Added to Cart | Shortlisted | Already Viewed,Kolar Bottomless Mosquito,"Net for Babies Portable... 0-2.5 years onwards, L 94 x B 76 xH 81 cm; Kolar Premium Mosquito Net for... (27 Ratings)  Sizes: L 94 x B 76 x H 81 cm Sizes: L 94 x B 76 x H 81 cm ADD TO CART",495.2,1000,50% Off,475.2
Added to Cart | Shortlisted | Already Viewed,Bestseller Babyhug Premium,"Bedding Super Save Combo Set of 3 Duck... 0 to 6 Months, L 90 x B 60 x H 46 cm, combo gadda set in attractive print... (630 Ratings)  Sizes: L 90 x B 60 x H 46 cm Sizes: L 90 x B 60 x H 46 cm Sizes: L 90 x B 60 x H 46 cm ADD TO CART",2279.43,3999,43% Off,2199.45
Added to Cart | Shortlisted | Already Viewed,Vparents Joy Jumbo,"Extra Large Baby Bedding Set With... 0 to 18 Months, L 111 x B 42 x H 96 cm, safe, comfortable and cozy... (94 Ratings)  Sizes: L 111 x B 42 x H 96 cm Sizes: L 111 x B 42 x H 96 cm Sizes: L 111 x B 42 x H 96 cm ADD TO CART",919.27,1599,43% Off,919.27
Added to Cart | Shortlisted | Already Viewed,Bestseller Babyhug Premium,"Bedding Super Saver Combo Jungle Print... 0 to 6 Months,L 90 x B 60 cm, combo gadda set for your baby's comfortable... (417 Ratings)  Sizes: L 63 X B 19 X H 50.5 cm Sizes: L 63 X B 19 X H 50.5 cm Sizes: L 63 X B 19 X H 50.5 cm ADD TO CART",2357.05,3995,44% Off,2277.15
Added to Cart | Shortlisted | Already Viewed,Bestseller Babyhug Foldable,"Mosquito Net Large Size Bear Theme -... 0 to 24 Months, L 135 x B 65 X H 65 cm, Made of breathable fabric which... (396 Ratings)  Sizes: C 135 x D 65 X H 65 cm Sizes: L 135 x B 65 X H 65 cm Sizes: L 135 x B 65 X H 65 cm ADD TO CART",825.41,1399,43% Off,797.43
Added to Cart | Shortlisted | Already Viewed,Bestseller Babyhug Foldable,"Mosquito Net Large Size Bunny Theme -... 0 to 24 Months, L 135 x B 65 X H 65 cm, Made of breathable fabric which... (396 Ratings)  Sizes: C 135 x D 65 X H 65 cm Sizes: L 135 x B 65 X H 65 cm Sizes: L 135 x B 65 X H 65 cm ADD TO CART",825.41,1399,43% Off,797.43
Added to Cart | Shortlisted | Already Viewed,Babyhug Premium Bedding,"Super Saver Combo Set of 3... 0 to 6 Months, L 90 x B 60 x H 46 cm, combo gadda set in attractive print... (630 Ratings)  Sizes: L 90 x B 60 x H 46 cm Sizes: L 90 x B 60 x H 46 cm Sizes: L 90 x B 60 x H 46 cm ADD TO CART",3719.07,3999,43% Off,3639.09
Added to Cart | Shortlisted | Already Viewed,Bestseller Babyhug Foldable,"Printed Mosquito Net Large Size... 0 to 24 Months, C 135 x D 65 X H 65 cm Made of breathable fabric which... (396 Ratings)  Sizes: C 135 x D 65 X H 65 cm Sizes: L 135 x B 65 X H 65 cm Sizes: L 135 x B 65 X H 65 cm ADD TO CART",797.43,1399,43% Off,769.45
Added to Cart | Shortlisted | Already Viewed,Premium Baby Jalebi,"The Sleep Cloud Personalised Nest With... 0 to 12 Months, L 90 x B 45 x H 15 cm, Light Ergonomic design , easy for... (11 Ratings)  Sizes: L 90 x B 45 x H 15 cm Sizes: L 90 x B 45 x H 15 cm Sizes: L 90 x B 45 x H 15 cm Sizes: L 90 x B 45 x H 15 cm ADD TO CART",14685.27,19999,27% Off,14285.29
Added to Cart | Shortlisted | Already Viewed | 1 Left,Babyhug Foldable Printed,"Mosquito Net Small Size... 0 to 12 Months, C 98 x D 50 X H 55 cm Made of breathable fabric which... (245 Ratings)  Sizes: C 98 x D 50 X H 55 cm Sizes: L 98 x B 50 X H 55 cm Sizes: L 98 x B 50 X H 55 cm ADD TO CART",683.43,1199,43% Off,659.45
Added to Cart | Shortlisted | Already Viewed,Babyhug Foldable Mosquito,"Net Small Size Bunny Theme -... 0 to 12 Months, L 98 x B 50 X H 55 cm, Made of breathable fabric which... (245 Ratings)  Sizes: C 98 x D 50 X H 55 cm Sizes: L 98 x B 50 X H 55 cm Sizes: L 98 x B 50 X H 55 cm ADD TO CART",743.38,1199,43% Off,719.4
Added to Cart | Shortlisted | Already Viewed,Today's Deal LifeKrafts,Foldable Baby Mosquito Net Bottomless - Grey LifeKrafts Foldable Baby Mosquito Net Grey. (2683 Ratings)  Sizes: EFB9C4 Sizes: L 110 x B 60 x H 55 cm Sizes: L 135 x B 65 x H 65 cm Sizes: L 135 x B 65 x H 65 cm Sizes: L 135 x B 65 x H 65 cm ADD TO CART,876.96,1050,16% Off,855.96
Added to Cart | Shortlisted | Already Viewed,Coupon Inside Babyhug,"Portable Baby Mosquito Net Large - Green 0 Months+, 120 X 78 X 40 cm , Made of soft and skin friendly fabric,... (4113 Ratings)  Sizes: 120 X 78 X 40 cm Sizes: 120 X 78 X 40 cm Sizes: 120 X 78 X 40 cm Sizes: 128 X 78 X 40 cm ADD TO CART",813.75,875,38% Off,796.25
Added to Cart | Shortlisted | Already Viewed,Mi Arcus Soft,"Printed Foldable Mattress Set with... 0 to 12 Months, L 102 x 54 cm, Soft Cottony Material for baby's soft skin (56 Ratings)  Sizes: L 102 x 54 cm Sizes: L 102 x 54 cm Sizes: L 102 x 54 cm Sizes: L 102 x B 54 cm Sizes: L 102 x B 54 cm ADD TO CART",1268.45,1499,15% Off,1268.45
Added to Cart | Shortlisted | Already Viewed,LuvLap Baby Bed,"with Thick Mattress, Mosquito Net with... 0 Months+, L 75 x B 40 x H 40 cm, Compact & foldable, the mosquito net... (389 Ratings)  Sizes: L 75 x B 40 x H 40 cm Sizes: L 75 x B 40 x H 40 cm Sizes: L 75 x B 43 x H 36 cm Sizes: L 75 x B 48 cm Sizes: L 75 x B 48 cm ADD TO CART",599.02,689,13% Off,599.02
Added to Cart | Shortlisted | Already Viewed,Bestseller Coupon Inside,"Babyhug 7 Layers High Density Plastic Storage Cabinet... 57.5 x 36 x 148 cm,Sturdy and spacious storage unit, Comes with a key to... (160 Ratings)  ADD TO CART",12089.07,12999,7% Off,11829.09
Added to Cart | Shortlisted | Already Viewed,TOYPENTER Collapsible Kids,Clothing Wardrobe |... Portable Waterproof Multipurpose Storage/Adjustable 3 Drawers Almirah for... (11 Ratings)  ADD TO CART,8257.5,15000,45% Off,8257.5
Added to Cart | Shortlisted | Already Viewed,Bestseller Multipurpose Storage,Shelves Sea Lion Print - Yellow Has 9 storage containers to store all the necessary things (14 Ratings)  Sizes: L 70 x B 38 x H 84 cm Sizes: L 70 x B 38 x H 84 cm ADD TO CART,4019.33,5999,33% Off,3899.35
Added to Cart | Shortlisted | Already Viewed,Bestseller R,"for Rabbit Little Genius Astro Organizer for Kids... L 37 x B 36 x H 102 cm, Multi-purpose and spacious storage units can be... (46 Ratings)  Sizes: L 37 x B 36 x H 102 cm Sizes: L 37 x B 36 x H 102 cm ADD TO CART",2796.07,3699,24% Off,2796.07
Added to Cart | Shortlisted | Already Viewed,Kuber Industries,"7-Tier Multipurpose Storage Drawers... L 32 x B 27 x H 117 cm, Featuring seven tiers of spacious drawers, this...  ADD TO CART",2609.55,5799,55% Off,2609.55
Added to Cart | Shortlisted | Already Viewed,New Babyhug,"6 Layer High Density Plastic Storage Cabinet... L 52 x B 34 x H 111 cm, Sturdy and spacious storage unit for kids, comes...  Sizes: 4 Layers Sizes: 5 Layers Sizes: 6 Layers Sizes: 7 Layers ADD TO CART",5889.38,9499,38% Off,5699.4
Added to Cart | Shortlisted | Already Viewed,Babyhug Disney,"5 Shelved Almirah With Wheels The Lion... L 51 x B 33 x H 148 cm, spacious storage unit with outer zippered cover... (24 Ratings)  Sizes: L 51 x B 33 x H 148 cm Sizes: L 51 x B 33 x H 148 cm ADD TO CART",2813.33,4199,33% Off,2729.35
Added to Cart | Shortlisted | Already Viewed,Bestseller Multipurpose Storage,Shelves Sea Lion Print - Yellow Has 6 storage containers to store all the necessary things (6 Ratings)  Sizes: L 70 x B 38 x H 65 cm Sizes: L 70 x B 38 x H 65 cm ADD TO CART,3349.33,4999,53% Off,3249.35
Added to Cart | Shortlisted | Already Viewed,Today's Deal TOYPENTER,Collapsible Kids Clothing Wardrobe | (Bebe... Portable Waterproof Multipurpose Storage/Adjustable 3 Drawers Almirah for... (6 Ratings)  ADD TO CART,8257.5,15000,45% Off,8257.5
Added to Cart | Shortlisted | Already Viewed,Bestseller Disney By,"Kuber Mart Industries Print Waterproof &... B 37 x H 42 cm, This Fabric Storage box can help you save space all the... (237 Ratings)  ADD TO CART",258.63,699,63% Off,258.63
Added to Cart | Shortlisted | Already Viewed,Bestseller Coupon Inside,"Babyhug 6 Layers High Density Plastic Storage Cabinet... 56 x 37 x 131 cm, Sturdy and spacious storage unit for kids, comes with a... (177 Ratings)  ADD TO CART",8639.28,11999,28% Off,8399.3
Added to Cart | Shortlisted | Already Viewed,6 Compartment Storage,"Cabinet Teddy Print - Pink 56 x 37.5 x 109.5 cm, Sturdy and spacious storage unit for kids, comes... (39 Ratings)  ADD TO CART",6199.38,9999,38% Off,5999.4
Added to Cart | Shortlisted | Already Viewed,Bestseller House,"of Quirk 3 Tier Storage Cabinet with Wheels ... 58 x 23 x 78 cm, House of Quirk Multi-Tier Storage Box Cabinet is a... (5 Ratings)  Sizes: L 58 x B 23 x H 125 cm,L 58 x B 23 x H 78 cm ADD TO CART",3126.37,4999,37% Off,3026.39
Added to Cart | Shortlisted | Already Viewed,New Babyhug,"5 Layer High Density Plastic Storage Cabinet... L 52 x B 34.5 x H 105 cm, Sturdy and spacious storage unit for kids, comes...  Sizes: 4 Layers Sizes: 5 Layers Sizes: 6 Layers Sizes: 7 Layers ADD TO CART",5269.38,8499,38% Off,5099.4
Added to Cart | Shortlisted | Already Viewed,Bestseller Fun Homes,"Folding Baby Clothes Drying Rack With 32... L 40 x B 30 x H 38 cm, Comes with a 360 degree rotating hook, Clips hold... (511 Ratings)  ADD TO CART",226.2,435,48% Off,226.2
Added to Cart | Shortlisted | Already Viewed,Today's Deal Multipurpose,Storage Shelves Monster Print - Green Has 6 storage containers to store all the necessary things (6 Ratings)  Sizes: L 70 x B 38 x H 65 cm Sizes: L 70 x B 38 x H 65 cm ADD TO CART,2349.53,4999,53% Off,2249.55
Added to Cart | Shortlisted | Already Viewed,Bestseller Coupon Inside,"Babyhug Set Of 6 Hangers - Cream And Light Brown Set of 6, Length 29 cm, A cute shaped hanger for drying your baby's clothes (4771 Ratings)  Sizes: 29 cm Sizes: 29 cm Sizes: 29 cm ADD TO CART",123.75,225,45% Off,119.25
Added to Cart | Shortlisted | Already Viewed,R Rabbit,"bbit Kiddo Korner Teddy Organizer Drawer for... L 45 x B 38 x H 89 cm, This storage solution is as functional as it is... (11 Ratings)  Sizes: L 45 x B 38 x H 89 cm Sizes: L 45 x B 38 x H 89 cm ADD TO CART",4161.09,5499,24% Off,3996.12
Added to Cart | Shortlisted | Already Viewed,Coupon Inside Babyhug,"5 Layers High Density Plastic Storage Cabinet... 57 x 35 x 109 cm, Sturdy and spacious storage unit for kids, comes with a... (51 Ratings)  ADD TO CART",6699.33,9999,33% Off,6499.35
