Status,Brand,Title,Discounted Price,Original Price,Discount Percent,Club Price
Added to Cart | Shortlisted | Already Viewed,Pine Kids Cotton,Woven Half Sleeves Checks Shirt With T Shirt -...,779.22,999,22% Off,759.24
Added to Cart | Shortlisted | Already Viewed,Babyoye Cotton,otton with Eco Jiva Finish Half Sleeves T-Shirts With...,710.21,899,21% Off,692.23
Added to Cart | Shortlisted | Already Viewed,Pine Kids Viscose,Woven Half Sleeves Printed Shirt - White,503.16,599,16% Off,491.18
Added to Cart | Shortlisted | Already Viewed | 1 Left,Doodle Poodle,100% Cotton Knit Sleeveless T-Shirt & Shorts Set...,242.73,279,13% Off,237.15
Added to Cart | Shortlisted | Already Viewed,Pine Kids Cotton,Woven Half Sleeves Checkered Shirt with Text Printed...,779.22,999,22% Off,759.24
Added to Cart | Shortlisted | Already Viewed,Mark Mia,ia Half Raglan Sleeves Two Piece Swimsuit With Shark Print &...,1138.83,1309,13% Off,1112.65
Added to Cart | Shortlisted | Already Viewed,Mark Mia,ia Half Raglan Sleeves Two Piece Swimsuit with Abstract...,1104.03,1269,13% Off,1078.65
Added to Cart | Shortlisted | Already Viewed,Pine Kids Cotton,Woven Half Sleeves Floral Print Shirt - Multicolour,503.16,599,16% Off,491.18
Added to Cart | Shortlisted | Already Viewed | 2 Left,Babyoye Cotton,otton with Eco Jiva Finish Half Sleeves T-Shirts With...,631.21,799,21% Off,615.23
Added to Cart | Shortlisted | Already Viewed,Babyhug Cotton Woven,Half Sleeves Shirt with Leaf Print - White,424.15,499,15% Off,414.17
Added to Cart | Shortlisted | Already Viewed | 2 Left,Babyoye Cotton,otton Knit with Eco Jiva Finish Half Sleeves T-Shirt...,631.21,799,21% Off,615.23
Added to Cart | Shortlisted | Already Viewed,Babyoye Cotton Linen,Woven Half Sleeves Solid Shirt with...,591.71,749,21% Off,576.73
Added to Cart | Shortlisted | Already Viewed,Mark Mia,ia Full Raglan Sleeves Two Piece Swimsuit With Crocodile...,947.43,1089,13% Off,925.65
Added to Cart | Shortlisted | Already Viewed,Mark Mia,ia Half Raglan Sleeves Two Piece Swimsuit with Abstract...,1104.03,1269,13% Off,1078.65
Added to Cart | Shortlisted | Already Viewed | 1 Left,Pine Kids Cotton,Woven Half Sleeves Shirt With Floral Print - White,631.21,799,21% Off,615.23
Added to Cart | Shortlisted | Already Viewed | 1 Left,Pine Kids Cotton,Woven Half Sleeves Shirt with Tropical Theme Print -...,631.21,799,21% Off,615.23
Added to Cart | Shortlisted | Already Viewed,Pine Kids Cotton,Woven Half Sleeves Shirt With Floral Print - Navy Blue,631.21,799,21% Off,615.23
Added to Cart | Shortlisted | Already Viewed,Babyoye Cotton,otton Knit Half Sleeves Eco Jiva Finish Rompers...,818.22,1049,22% Off,797.24
Added to Cart | Shortlisted | Already Viewed,Mark Mia,ia Full Raglan Sleeves Printed Two Piece Swimsuit - Navy...,982.23,1129,13% Off,959.65
Added to Cart | Shortlisted | Already Viewed,Mark Mia,ia Half Raglan Sleeves Two Piece Swimsuit With Shark Print &...,982.23,1129,13% Off,959.65
Added to Cart | Shortlisted | Already Viewed,Babyhug Single Jersey,Knit Mid Thigh Shorts Floral & Hearts Print Pack...,538.23,699,23% Off,524.25
Added to Cart | Shortlisted | Already Viewed,Babyhug Single Jersey,Knit Mid Thigh Shorts Floral Print Pack of 3 -...,587.16,699,16% Off,573.18
Added to Cart | Shortlisted | Already Viewed,Kookie Kids Cotton,Sleeveless Frock with Bunny & Carrot Patch -...,846.75,1129,25% Off,824.17
Added to Cart | Shortlisted | Already Viewed,Kookie Kids Cotton,Knit Frill Sleeves Frockstyle Onesie with...,629.37,999,37% Off,609.39
Added to Cart | Shortlisted | Already Viewed,Pine Kids Cotton,Knit Half Sleeves T-Shirt with Pretty Girl Text...,299.25,399,25% Off,291.27
Added to Cart | Shortlisted | Already Viewed,Babyhug Single Jersey,Knit Mid Thigh Shorts Floral Print Pack of 3 -...,587.16,699,16% Off,573.18
Added to Cart | Shortlisted | Already Viewed,Doodle Poodle Cotton,Knit Frill Sleeves Frock with Floral Print -...,251.16,299,16% Off,245.18
Added to Cart | Shortlisted | Already Viewed,Babyhug Disney Single,Jersey Knit Half Sleeve T-Shirts Pack Of 3...,857.22,1099,22% Off,835.24
Added to Cart | Shortlisted | Already Viewed,Babyhug Single Jersey,Knit Mid Thigh Shorts Floral Print Pack of 3 -...,587.16,699,16% Off,573.18
Added to Cart | Shortlisted | Already Viewed | 1 Left,Mark Mia,ia Sleeveless V Cut Swimsuit with Frill Detailing - Pink & White,1104.03,1269,13% Off,1078.65
Added to Cart | Shortlisted | Already Viewed,Dew Drops Organza,Half Sleeves Frocks with Floral Print & Bow...,521.13,599,13% Off,509.15
Added to Cart | Shortlisted | Already Viewed | 2 Left,Ollington St. Cotton,Knit Half Sleeves Jacket Top & Dungree with...,923.23,1199,23% Off,899.25
Added to Cart | Shortlisted | Already Viewed,Mark Mia,ia Sleeveless V Cut Swimsuit With Bow Applique - Pink & White,1295.43,1489,13% Off,1265.65
Added to Cart | Shortlisted | Already Viewed,Pine Kids Woven,Knee Length Solid Color Shorts - Light Blue,437.27,599,27% Off,425.29
Added to Cart | Shortlisted | Already Viewed,Babyhug Cotton,otton Knit Single Jersey Singlet Sleeves Frock With...,260.13,299,13% Off,254.15
Added to Cart | Shortlisted | Already Viewed,Ollington St. Sinker,Knit Half Sleeves Drop Shoulder Top & Denim...,780.29,1099,30% Off,758.31
Added to Cart | Shortlisted | Already Viewed,Pine Kids Woven,Knee Length Solid Color Shorts - Navy Blue,503.16,599,16% Off,491.18
Added to Cart | Shortlisted | Already Viewed | 1 Left,Hola Bonita Knit,Sleeveless Solid Color Halter Neck Dress - Neon...,710.21,899,22% Off,692.23
Added to Cart | Shortlisted | Already Viewed,Babyhug Cotton,otton Knit Sleeveless Floral Printed Frock Style Onesie...,424.15,499,15% Off,414.17
Added to Cart | Shortlisted | Already Viewed,Mark Mia,ia Sleeveless Frock Swimsuit With Girl Power Print - Blue,1215.81,1539,21% Off,1185.03
Added to Cart | Shortlisted | Already Viewed,Mark Mia,ia Half Raglan Sleeves Legged Swimsuit with Unicorn...,947.43,1089,13% Off,925.65
Added to Cart | Shortlisted | Already Viewed,Mark Mia,ia Full Sleeves Legged Swimsuit With Bunny Print & Frill...,965.16,1149,16% Off,942.18
Added to Cart | Shortlisted | Already Viewed,Mark Mia,ia Singlet V Cut Swimsuit with Frill Detailing -Neon Pink,925.65,1089,15% Off,903.87
Added to Cart | Shortlisted | Already Viewed | 1 Left,Mark Mia,ia Half Raglan Sleeves Legged Swimsuit with Cap Dino...,982.23,1129,13% Off,959.65
Added to Cart | Shortlisted | Already Viewed,Mark Mia,ia Sleeveless V Cut Swimsuit with Dino Print - White & Pink,936.54,1089,14% Off,914.76
Added to Cart | Shortlisted | Already Viewed,Mark Mia,ia Singlet V Cut Swimsuit with Frill Detailing & Unicorn...,936.54,1089,14% Off,914.76
Added to Cart | Shortlisted | Already Viewed,Mark Mia,ia Sleeveless V Cut Swimsuit with Tropical Print with Frill...,925.65,1089,15% Off,903.87
Added to Cart | Shortlisted | Already Viewed,Mark Mia,ia Full Sleeves Legged Swimsuit with Cap & Tropical...,947.43,1089,13% Off,925.65
Added to Cart | Shortlisted | Already Viewed,Mark Mia,ia Half Raglan Frock Swimsuit with Tropical Print - Blue,1112.65,1309,15% Off,1086.47
Added to Cart | Shortlisted | Already Viewed | 1 Left,Mark Mia,ia Half Raglan Sleeves Legged Swimsuit with Cap Dino...,982.23,1129,13% Off,959.65
Added to Cart | Shortlisted | Already Viewed,Mark Mia,ia Sleeveless V Cut Swimsuit with Unicorn Print with Frill...,805.86,1089,26% Off,784.08
Added to Cart | Shortlisted | Already Viewed | 1 Left,Babyhug Frill Sleeves,Water Repellent Two Piece Swimsuit with...,782.13,899,13% Off,764.15
Added to Cart | Shortlisted | Already Viewed,Babyhug Sleeveless Water,Repellent Two Piece Swimsuit With Frill &...,764.15,899,15% Off,746.17
Added to Cart | Shortlisted | Already Viewed | 1 Left,Mark Mia,ia Half Raglan Sleeves Legged Swimsuit with Space Theme...,1078.65,1269,15% Off,1053.27
Added to Cart | Shortlisted | Already Viewed,Mark Mia,ia Swimming Trunks & Cap with Dino Print & Applique -...,390.15,459,15% Off,380.97
Added to Cart | Shortlisted | Already Viewed | 1 Left,Mark Mia,ia Half Sleeves Legged Swimsuit with Cap Dino Print...,982.23,1129,13% Off,959.65
Added to Cart | Shortlisted | Already Viewed | 1 Left,Mark Mia,ia Half Raglan Sleeves Legged Swimsuit with Cap Dino ...,982.23,1129,13% Off,959.65
Added to Cart | Shortlisted | Already Viewed,Mark Mia,ia Half Raglan Sleeves Legged Swimsuit with Cap Dino...,936.54,1089,14% Off,914.76
Added to Cart | Shortlisted | Already Viewed | 1 Left,Mark Mia,ia Half Sleeves Legged Swimsuit with Astronaut Print...,1078.65,1269,15% Off,1053.27
Added to Cart | Shortlisted | Already Viewed,Mark Mia,ia Half Raglan Sleeves Legged Swimsuit with Dino ...,893.54,1039,14% Off,872.76
Added to Cart | Shortlisted | Already Viewed,Babyhug Disney Mickey,Mouse Summer Cap - White,473.21,599,21% Off,461.23
Added to Cart | Shortlisted | Already Viewed,Babyhug Disney Princess,Summer Cap - Pink,457.41,579,21% Off,445.83
Added to Cart | Shortlisted | Already Viewed,Babyhug Marvel Spiderman,Summer Cap - Blue,417.91,529,21% Off,407.33
Added to Cart | Shortlisted | Already Viewed,Pine Kids Marvel,Captain America Summer Cap Blue - Diameter 16.5 cm,455.24,599,24% Off,443.26
Added to Cart | Shortlisted | Already Viewed,Doodle Poodle Preemie,Interlock Knit Cap Mittens & Booties Set With...,347.13,399,13% Off,339.15
Added to Cart | Shortlisted | Already Viewed,Pine Kids Straw,Hat With Butterfly Applique Beige - Diameter 17 cm,360.36,429,23% Off,351.78
Added to Cart | Shortlisted | Already Viewed,Babyhug Disney Mickey,Mouse Summer Cap - Mustard,441.61,559,24% Off,430.43
Added to Cart | Shortlisted | Already Viewed,Pine Kids Marvel,Avengers Summer Caps Multicolour - Diameter 16.5 cm,434.25,579,25% Off,422.67
Added to Cart | Shortlisted | Already Viewed,Ben Benny,100% Cotton Knit Solid & Printed Mittens & Booties Pack of...,239.94,279,14% Off,234.36
Added to Cart | Shortlisted | Already Viewed,Babyhug Mickey Mouse,Summer Cap - Red & Blue,380.88,529,28% Off,370.3
Added to Cart | Shortlisted | Already Viewed,KIDSUN UV,0% UV Protection Round Sunglasses - Pink,499.5,999,50% Off,499.5
Added to Cart | Shortlisted | Already Viewed,Babymoon Set Of,3 Cotton Princess Designer Headbands - Multi,292.5,750,61% Off,292.5
Added to Cart | Shortlisted | Already Viewed,Doodle Poodle,100% Cotton Knit Cap Mittens & Booties Set Car Print...,190.53,219,13% Off,186.15
Added to Cart | Shortlisted | Already Viewed,Babyhug Cotton Bear,Print With Stripes & Ear Applique Baseball...,430.55,545,21% Off,419.65
Added to Cart | Shortlisted | Already Viewed,Pine Kids Marvel,Cotton Avengers Baseball Cap White - Diameter...,457.41,579,27% Off,445.83
Added to Cart | Shortlisted | Already Viewed,Babyhug Marvel Interlock,Knit Cap Mittens & Booties Set with...,335.16,399,16% Off,327.18
Added to Cart | Shortlisted | Already Viewed,Babyhug Bucket Hat,Fruits Print - Orange,419.16,499,16% Off,409.18
Added to Cart | Shortlisted | Already Viewed,Babyhug Marvel Cotton,Summer Cap With Captain Amercia Graphics -...,395.28,549,28% Off,384.3
Added to Cart | Shortlisted | Already Viewed,Babyhug Disney Cotton,Woven Bucket Cap with Minnie Mouse Print - Pink,384.3,549,30% Off,373.32
Added to Cart | Shortlisted | Already Viewed,Babyhug Free Size,Baseball Cap With Bear Embroidery - White,402.11,509,21% Off,391.93
Added to Cart | Shortlisted | Already Viewed,Hola Bonita Cotton,Woven Half Sleeves Solid Denim Dress - Blue,857.22,1099,22% Off,835.24
Added to Cart | Shortlisted | Already Viewed | 2 Left,Hola Bonita Sleeveless,Solid Color Knee Length Dress - Red,1000.23,1299,38% Off,974.25
Added to Cart | Shortlisted | Already Viewed,Dew Drops Organza,Half Sleeves Frocks with Floral Print & Bow...,521.13,599,13% Off,509.15
Added to Cart | Shortlisted | Already Viewed | 1 Left,Doodle Poodle Single,Jersey Knit Half Sleeves Frocks With Floral &...,495.03,569,13% Off,483.65
Added to Cart | Shortlisted | Already Viewed | 1 Left,Hola Bonita Knit,Frill Sleeves Solid Dress With Ribbed Pattern - Green,710.21,899,22% Off,692.23
Added to Cart | Shortlisted | Already Viewed,Hola Bonita Cotton,Woven Half Puffed Sleeves Inner T-Shirt & Denim...,1063.24,1399,24% Off,1035.26
Added to Cart | Shortlisted | Already Viewed | 2 Left,Simply Premium Cotton,Woven Frill Sleeves Checkered Frock - Pink,485.9,565,14% Off,474.6
Added to Cart | Shortlisted | Already Viewed,Babyhug Disney Single,Jersey Knit Frill Sleeves Frock With Minnie...,670.71,849,21% Off,653.73
Added to Cart | Shortlisted | Already Viewed | 2 Left,Fashion Dream Georgette,Sleeveless Frill Detailed Floral Printed...,857.56,1949,56% Off,857.56
Added to Cart | Shortlisted | Already Viewed,Ollington St. Sinker,Woven Half Sleeves Top & Printed Lycra Twill...,779.22,999,22% Off,759.24
Added to Cart | Shortlisted | Already Viewed,Babyoye Cotton,otton Knit Half Sleeves Floral Printed Dress With...,631.21,799,21% Off,615.23
Added to Cart | Shortlisted | Already Viewed,Premium Arias Cotton,Knit Half Sleeves Front Open Knee Length Shirt Dress with...,664.3,949,30% Off,645.32
Added to Cart | Shortlisted | Already Viewed | 1 Left,Hola Bonita Woven,Half Sleeves Knee Length Floral Printed Dress - Red,857.22,1099,23% Off,835.24
Added to Cart | Shortlisted | Already Viewed | 1 Left,Babyoye Cotton,otton Poplin Woven Half Puffed Sleeves Tiered Frock...,857.22,1099,22% Off,835.24
Added to Cart | Shortlisted | Already Viewed,Pine Kids Cotton,Woven Half Puffed Sleeves Solid Frock - White,839.16,999,16% Off,819.18
Added to Cart | Shortlisted | Already Viewed,Babyhug Single Jersey,Knit Half Sleeves Frocks with Heart &...,587.16,699,16% Off,573.18
Added to Cart | Shortlisted | Already Viewed,Hola Bonita Nylon,Knit Frill Sleeves Dress in Lace Fabric - Pink,857.22,1099,23% Off,835.24
Added to Cart | Shortlisted | Already Viewed,Pine Kids Cotton,Woven Half Puffed Sleeves Frock with Floral...,779.22,999,22% Off,759.24
Added to Cart | Shortlisted | Already Viewed,Pine Kids Rayon,Woven Frill Sleeves Dress With Floral & Leaf Print -...,611.32,899,33% Off,593.34
Added to Cart | Shortlisted | Already Viewed | 1 Left,Mark Mia,ia Sleeveless Singlet Yarn Dyed Striped Frocks with Smocking...,631.21,799,21% Off,615.23
Added to Cart | Shortlisted | Already Viewed,Kookie Kids Half,Sleeves Frock Style Onesie with Bow & Applique - Yellow,644.25,859,25% Off,627.07
Added to Cart | Shortlisted | Already Viewed,Babyhug Single Jersey,Knit Half Sleeves T-Shirt & Dungaree with...,665.26,899,26% Off,647.28
Added to Cart | Shortlisted | Already Viewed | 2 Left,Kookie Kids Cotton,Knit Sleeveless Jumpsuit with Bow Applique -...,749.25,999,25% Off,729.27
Added to Cart | Shortlisted | Already Viewed,Babyhug Disney Single,Jersey Knit Dungaree & Half Sleeves Striped...,818.37,1299,37% Off,792.39
Added to Cart | Shortlisted | Already Viewed,Babyhug Single Jersey,Knit Half Sleeves T-Shirt & Dungaree Set...,683.24,899,24% Off,665.26
Added to Cart | Shortlisted | Already Viewed | 1 Left,Baby Naturelle,& Me Interlock Knit Half Sleeves Romper With Dino...,431.1,479,10% Off,421.52
Added to Cart | Shortlisted | Already Viewed,Babyhug Cotton,otton Knit Half Sleeves Frock Style Onesie with...,419.16,499,16% Off,409.18
Added to Cart | Shortlisted | Already Viewed,Babyhug Disney Interlock,Knit Half Sleeves Onesies with Mickey &...,791.34,1199,34% Off,767.36
Added to Cart | Shortlisted | Already Viewed,Premium Bonfino,100% Cotton Knit Frill Sleeves Rompers With Unicorn &...,1490.29,2099,29% Off,1448.31
Added to Cart | Shortlisted | Already Viewed,Kookie Kids Sleeveless,Striped Romper With Teddy Bear Applique...,466.56,729,36% Off,451.98
Added to Cart | Shortlisted | Already Viewed,Babyhug Disney Single,Jersey Knit Half Sleeves T-Shirt & Dungaree...,755.37,1199,37% Off,731.39
Added to Cart | Shortlisted | Already Viewed,The Souled Store,Cotton Mickey & Friends Featuring Sleeveless...,1301.07,1399,7% Off,1301.07
Added to Cart | Shortlisted | Already Viewed | 1 Left,Premium Bonfino,100% Cotton Knit Half Sleeves Rompers with Tropical...,1063.24,1399,24% Off,1035.26
Added to Cart | Shortlisted | Already Viewed | 1 Left,Mark Mia,ia Denim Dungaree & Half Sleeves Striped Cotton T-Shirt...,1254.33,1629,23% Off,1221.75
Added to Cart | Shortlisted | Already Viewed | 1 Left,Mark Mia,ia Cotton Sleeveless Onesie with Bear Applique & Print - Beige,678.61,859,21% Off,661.43
Added to Cart | Shortlisted | Already Viewed | 1 Left,Mark Mia,ia Cotton Sleeveless Onesie with Bow Applique & Floral Print...,740.22,949,22% Off,721.24
Added to Cart | Shortlisted | Already Viewed | 3 Left,Babyoye Disney Cotton,Interlock Knit Half Sleeves Rompers with Lion...,713.32,1049,32% Off,713.32
Added to Cart | Shortlisted | Already Viewed | 1 Left,Mark Mia,ia Denim Dungaree & Half Sleeves Striped Cotton T-Shirt...,1254.33,1629,23% Off,1221.75
Added to Cart | Shortlisted | Already Viewed | 1 Left,Mark Mia,ia Cotton Frill Sleeves Onesie with with Bunny Applique &...,678.61,859,21% Off,661.43
Added to Cart | Shortlisted | Already Viewed,Babyhug Disney Interlock,Knit Half Sleeves Front Open Collared Cut &...,535.33,799,33% Off,519.35
Added to Cart | Shortlisted | Already Viewed,Pine Kids Looper,Knit Above Knee Length Shorts with Tropical Theme...,419.16,499,16% Off,409.18
Added to Cart | Shortlisted | Already Viewed,Premium Honeyhap Premium,100% Cotton Knit Bio Finish Above Knee Length...,538.23,699,31% Off,524.25
Added to Cart | Shortlisted | Already Viewed,Mark Mia,ia Denim Shorts With Frill Detailing & Bow Applique - Light...,619.38,999,38% Off,599.4
Added to Cart | Shortlisted | Already Viewed,Pine Kids Cotton,Elastane Woven Above Knee Length Shorts...,552.21,699,26% Off,538.23
Added to Cart | Shortlisted | Already Viewed | 3 Left,Stylo Bug Cotton,Solid Shorts - Black,553.56,1318,63% Off,553.56
Added to Cart | Shortlisted | Already Viewed,Babyhug Cotton Knit,Shorts With Numbers & Polka Dots Print Pack...,496.29,699,29% Off,482.31
Added to Cart | Shortlisted | Already Viewed,Premium Honeyhap Premium,100% Cotton Single Jersey Knit Shorts with Bio...,413.31,599,31% Off,401.33
Added to Cart | Shortlisted | Already Viewed | 2 Left,Pine Kids,100% Cotton Knit Above Knee Length Solid Color Shorts -...,349.3,499,31% Off,339.32
Added to Cart | Shortlisted | Already Viewed,Mark Mia,ia Washed Denim Shorts With Rabbit & Heart Embroidery & Bow...,679.32,999,32% Off,659.34
Added to Cart | Shortlisted | Already Viewed | 1 Left,Pine Kids Woven,Mid Thigh Washed Denim Shorts - White,587.16,699,22% Off,573.18
Added to Cart | Shortlisted | Already Viewed,Mark Mia,ia Denim Knee length Shorts Embroidery Detailing- Light Blue,587.16,699,16% Off,573.18
Added to Cart | Shortlisted | Already Viewed,Babyhug Cotton Jersey,Knitted Knee Length Shorts Striped - White,482.31,699,31% Off,468.33
Added to Cart | Shortlisted | Already Viewed,Babyhug Cotton Knit,Shorts Text Print Pack of 3 - Multicolour,482.31,699,31% Off,468.33
Added to Cart | Shortlisted | Already Viewed,Kidsville Jurassic World,Featuring Character Printed Shorts - Red &...,849.15,999,15% Off,849.15
Added to Cart | Shortlisted | Already Viewed,Babyhug Cotton Knit,Mid Thigh Length Shorts with Floral & Smiley Print...,587.16,699,16% Off,573.18
Added to Cart | Shortlisted | Already Viewed,Pine Kids Above,Knee Length Washed Denim Shorts - Navy Blue,587.16,699,21% Off,573.18
Added to Cart | Shortlisted | Already Viewed,CUCUMBER Sinker Knit,Above Knee Length Shorts with Floral Print...,327.6,390,16% Off,319.8
Added to Cart | Shortlisted | Already Viewed,Babyhug Cotton Knit,Shorts with Floral Print Bow Applique Pack...,538.23,699,23% Off,524.25
Added to Cart | Shortlisted | Already Viewed,Babyhug Single Jersey,Knit Mid Thigh Shorts with Polka Dot Floral...,587.16,699,16% Off,573.18
Added to Cart | Shortlisted | Already Viewed,Kidsville Sonic The,Hedgehog Featuring Character Printed...,839.2,1049,20% Off,839.2
Added to Cart | Shortlisted | Already Viewed,Babyhug Cotton Knit,Single Jersey Half Sleeves Night Suit With...,444.36,529,16% Off,433.78
Added to Cart | Shortlisted | Already Viewed | 2 Left,Babyhug Cotton Knit,Single Jersey Half Sleeves Night Suit With...,428.22,549,22% Off,417.24
Added to Cart | Shortlisted | Already Viewed,Pine Kids Single,Jersey Knit Half Sleeves Shorts Night Suit with...,587.16,699,16% Off,573.18
Added to Cart | Shortlisted | Already Viewed | 1 Left,Babyhug Cotton Knit,Half Sleeves Night Suit with Beach Theme Print...,461.16,549,16% Off,450.18
Added to Cart | Shortlisted | Already Viewed,Babyhug Cotton Knit,Half Sleeves Night Suit with Construction...,433.71,549,21% Off,422.73
Added to Cart | Shortlisted | Already Viewed,Babyhug Cotton Knit,Half Sleeves Co-ords Shorts Night Suit with...,419.16,499,16% Off,409.18
Added to Cart | Shortlisted | Already Viewed,Babyhug Cotton Knit,Half Sleeves Co-ords Shorts Night Suit with...,419.16,499,16% Off,409.18
Added to Cart | Shortlisted | Already Viewed,ToffyHouse Cotton Knit,Half Sleeves Night Suit With Tie & Dye Print -...,499.8,595,16% Off,487.9
Added to Cart | Shortlisted | Already Viewed,Babyhug Cotton Woven,Full Sleeves Night Suit with Starfish Print -...,545.16,649,16% Off,532.18
Added to Cart | Shortlisted | Already Viewed,Babyhug Cotton Knit,Half Sleeves Shorts Night Suit with Bear Print...,424.15,499,15% Off,414.17
Added to Cart | Shortlisted | Already Viewed | 1 Left,Babyhug Cotton Knit,Single Jersey Half Sleeves Capri Night Suit...,424.15,499,15% Off,414.17
Added to Cart | Shortlisted | Already Viewed | 1 Left,Babyhug Disney Single,Jersey Knit Full Sleeves Night Suit With...,710.21,899,21% Off,692.23
Added to Cart | Shortlisted | Already Viewed | 1 Left,Babyhug Cotton Half,Sleeves Night Suit Strawberry Print & Bow...,335.16,399,16% Off,327.18
Added to Cart | Shortlisted | Already Viewed,Babyhug Single Jersey,Knit Half Sleeves Night Suit Chameleon...,417.24,549,24% Off,406.26
Added to Cart | Shortlisted | Already Viewed | 1 Left,Babyhug Cotton Knit,Half Sleeves Night Suit With Smiley Print -...,373.62,479,22% Off,364.04
Added to Cart | Shortlisted | Already Viewed,Babyhug Cotton Single,Jersey Knit Sleeveless Night Suit Strawberry...,419.16,499,16% Off,409.18
Added to Cart | Shortlisted | Already Viewed,Babyhug Disney Single,Jersey Knit Full Sleeves Front Open Night...,683.24,899,24% Off,665.26
Added to Cart | Shortlisted | Already Viewed | 1 Left,Sheer Love Cotton,Jersey Knit Half Sleeves Vehicles Printed Night...,755.28,1049,28% Off,734.3
Added to Cart | Shortlisted | Already Viewed,Premium Bonfino Cotton,Knit Full Sleeves Footed Sleep Suits With Ice Cream...,961.26,1299,26% Off,935.28
Added to Cart | Shortlisted | Already Viewed,Babyhug Single Jersey,Knit Half Sleeves Night Suit with...,419.16,499,16% Off,409.18
Added to Cart | Shortlisted | Already Viewed,Kids Umbrella,"with J Shaped Handle & Cat Print - Orange 2 to 6 Years, D 77 x H 62 cm, A stylish and compact umbrella that keeps...  ADD TO CART",511.56,609,16% Off,499.38
Added to Cart | Shortlisted | Already Viewed,Free-size Umbrella With,"Bear Print - Blue 3 to 8 Years, Diameter 84 cm, Cute, Lightweight and easy to grip  Sizes: Diameter 84 cm Sizes: Diameter 84 cm Sizes: Diameter 84 cm Sizes: Diameter 84 cm ADD TO CART",494.34,749,35% Off,479.36
Added to Cart | Shortlisted | Already Viewed,Kids Umbrella,"with J Shaped Handle & Dinosaur Print -... 2 to 6 Years, D 80 x H 65 cm, A stylish and compact umbrella that keeps...  ADD TO CART",288.15,339,15% Off,281.37
Added to Cart | Shortlisted | Already Viewed,New CHAATEWALA Sunflower,"Designed Transparent Umbrella -... 6 to 14 Years, Attractive easy grip umbrella for your baby.  Sizes: 6Y Sizes: 6Y Sizes: 6Y Sizes: 6Y Sizes: 6Y Sizes: 6Y ADD TO CART",819.18,999,18% Off,799.2
Added to Cart | Shortlisted | Already Viewed,New CHAATEWALA Sunflower,"Designed Transparent Dome Shape... 6 to 14 Years, Attractive easy grip umbrella for your baby.  ADD TO CART",819.18,999,18% Off,799.2
Added to Cart | Shortlisted | Already Viewed,Kids Umbrella,"with J Shaped Handle Unicorn Print &... 2 to 6 Years, D 77 x H 62 cm, A stylish and compact umbrella that keeps...  ADD TO CART",511.56,609,16% Off,499.38
Added to Cart | Shortlisted | Already Viewed,Kids Umbrella,"with J Shaped Handle & Animal Print -... 2 to 6 Years, D 80 x H 65 cm, A stylish and compact umbrella that keeps...  ADD TO CART",288.15,339,15% Off,281.37
Added to Cart | Shortlisted | Already Viewed,Kids Umbrella,"with J Shaped Handle Butterfly Print -... 2 to 6 Years, D 77 x H 62 cm, A stylish and compact umbrella that keeps...  ADD TO CART",511.56,609,16% Off,499.38
Added to Cart | Shortlisted | Already Viewed,New CHAATEWALA Dinosaurs,"Designed Umbrella - Multi Colour 6 to 14 Years, Attractive easy grip umbrella for your baby.  ADD TO CART",819.18,999,18% Off,799.2
Added to Cart | Shortlisted | Already Viewed,New CHAATEWALA Cars,"Designed Colour Changing Magical... 6 to 14 Years, Attractive easy grip umbrella for your baby.  Sizes: 6Y Sizes: 6Y ADD TO CART",1065.18,1299,18% Off,1039.2
Added to Cart | Shortlisted | Already Viewed,Kids Umbrella,"with J Shaped Handle Mermaid Print &... 2 to 6 Years, D 77 x H 62 cm, A stylish and compact umbrella that keeps...  ADD TO CART",511.56,609,16% Off,499.38
Added to Cart | Shortlisted | Already Viewed,Kids Umbrella,"with J Shaped Handle Shark Print - Blue 2 to 6 Years, D 77 x H 62 cm, A stylish and compact umbrella that keeps...  ADD TO CART",511.56,609,16% Off,499.38
Added to Cart | Shortlisted | Already Viewed,Rabbit Printed J,"Shaped Handle Umbrella - Purple 3 to 10 Years , D 80 x H 52 cm, Add a touch of playful charm to rainy days...  ADD TO CART",267.81,339,21% Off,261.03
Added to Cart | Shortlisted | Already Viewed,New CITIZEN Marvel,"Featuring Spiderman Designed Auto Open... 4 to 12 Years, Attractive easy grip umbrella for your baby.  ADD TO CART",340.69,799,57% Off,340.69
